Non-US,38,BEKB.BR,Bekaert,Belgium,Euronext Brussels,67.0,Steel wire/materials,Low,High,16,16,15,11,9,1,2.322,,Mid,"Advanced steel wire and reinforcement materials could support electrification, enclosures and industrial construction",No direct AI supply-chain supplier evidence found; steel wire transformation and coatings.,Qualitative valuation setup; no reliable non-US quote snapshot returned by finance tool,https://www.bekaert.com/,Materials / chemicals,42.1,EUR,2322212249.13,2.322,8.65,2026-06-03,https://finance.yahoo.com/quote/BEKB.BR/,66.0,0.0,66.0,1.0,,AI 2027/current overlay: no direct factor; bonus +1.0 after cap/YTD discipline.
Non-US,39,RDX.AX,Redox,Australia,ASX,67.0,Chemical distribution,Medium,High,17,18,14,13,7,3,1.244,,Small/mid,"Chemical distribution could supply coolants, water-treatment chemistry and process inputs if new suppliers are needed",No direct AI infrastructure supplier evidence found; chemicals and ingredients distribution.,Qualitative valuation setup; no reliable non-US quote snapshot returned by finance tool,https://redox.com/,Distribution / MRO,3.33,AUD,1243649060.56,1.244,8.47,2026-06-03,https://finance.yahoo.com/quote/RDX.AX/,66.0,0.0,66.0,1.0,,AI 2027/current overlay: no direct factor; bonus +1.0 after cap/YTD discipline.
Non-US,40,DPLM.L,Diploma,United Kingdom,LSE,67.0,Seals/controls distribution,Medium,Medium,18,15,13,13,11,3,12.66,,Mid/large,"Seals, controls and life-science/industrial distribution could aggregate hard-to-source fluid-control components","No direct AI build-out supplier evidence found; distribution into controls, seals and life sciences.",Qualitative valuation setup; no reliable non-US quote snapshot returned by finance tool,https://www.diplomaplc.com/,Distribution / MRO,7050.0,GBp,12659853520.67,12.66,33.14,2026-06-03,https://finance.yahoo.com/quote/DPLM.L/,67.0,0.0,67.0,0.0,,AI 2027/current overlay: no direct factor; bonus +0.0 after cap/YTD discipline.
US,43,OSK,Oshkosh,United States,NYSE,66.5,Specialty vehicles/electrification,Low,High,15,12,19,11,10,1,7.866,15.2888,,"Electrified, autonomous and specialty platforms could map to physical logistics and construction of new compute infrastructure",No direct AI supply-chain revenue evidence found; specialty vehicles/defense/fire/access equipment.,"Live US quote snapshot via finance tool, 2026-05-06 UTC",https://www.oshkoshcorp.com/,Industrial equipment,133.385,USD,7865617630.0,7.866,0.88,2026-06-03,https://finance.yahoo.com/quote/OSK/,66.0,0.0,66.0,0.5,,AI 2027/current overlay: no direct factor; bonus +0.5 after cap/YTD discipline.
Non-US,41,SGM.AX,Sims,Australia,ASX,66.5,Metal recycling,Low,High,16,18,15,12,8,1,3.743,,Mid,"Metal recycling could capture circularity demand as AI hardware, cabling and facility materials scale",No direct AI supply-chain evidence found; metal recycling and circular materials.,Qualitative valuation setup; no reliable non-US quote snapshot returned by finance tool,https://www.simsmm.com/,Recycling / critical materials,28.39,AUD,3742693087.95,3.743,55.82,2026-06-03,https://finance.yahoo.com/quote/SGM.AX/,68.0,0.0,68.0,-1.5,,AI 2027/current overlay: no direct factor; bonus -1.5 after cap/YTD discipline.
Non-US,42,BRG.OL,Borregaard,Norway,Oslo,66.4,Bio-based specialty chemicals,Low,High,15,17,14,10,9,1,1.503,,Mid,"Biopolymers and specialty cellulose could be used in binders, dispersants or sustainable process chemistry",No direct AI infrastructure evidence found; bio-based specialty chemicals.,Qualitative valuation setup; no reliable non-US quote snapshot returned by finance tool,https://www.borregaard.com/,Materials / chemicals,139.2,NOK,1503276240.14,1.503,-29.2,2026-06-03,https://finance.yahoo.com/quote/BRG.OL/,64.0,0.0,64.0,2.4,,AI 2027/current overlay: no direct factor; bonus +2.4 after cap/YTD discipline.
Non-US,43,WIE.VI,Wienerberger,Austria,Vienna,65.9,Pipes/building products,Low,High,15,16,14,11,9,1,3.053,,Mid,Piping and building envelope products could matter in water reuse and resilient industrial campuses,No direct AI infrastructure evidence found; building products and piping systems.,Qualitative valuation setup; no reliable non-US quote snapshot returned by finance tool,https://www.wienerberger.com/,Industrial equipment,23.68,EUR,3053110541.7,3.053,-21.59,2026-06-03,https://finance.yahoo.com/quote/WIE.VI/,64.0,0.0,64.0,1.9,,AI 2027/current overlay: no direct factor; bonus +1.9 after cap/YTD discipline.
Non-US,44,SFSN.SW,SFS Group,Switzerland,SIX,65.5,Precision fasteners,Low,High,16,16,13,11,10,1,6.408,,Mid,Precision fasteners and components could support compact mechanical assemblies and automation hardware,No direct AI supply-chain evidence found; fastening systems and precision components.,Qualitative valuation setup; no reliable non-US quote snapshot returned by finance tool,https://www.sfs.com/,Industrial equipment,128.8,CHF,6408357089.58,6.408,13.78,2026-06-03,https://finance.yahoo.com/quote/SFSN.SW/,65.0,0.0,65.0,0.5,,AI 2027/current overlay: no direct factor; bonus +0.5 after cap/YTD discipline.
Non-US,45,TOM.OL,Tomra,Norway,Oslo,65.4,Sensor sorting/recycling,Low,Medium,17,14,12,12,10,2,2.995,,Mid/large,Sensor-based sorting and recycling could help recover metals/plastics as AI hardware cycles accelerate,No direct AI infrastructure evidence found; sorting and recycling technology.,Qualitative valuation setup; no reliable non-US quote snapshot returned by finance tool,https://www.tomra.com/,Recycling / critical materials,97.0,NOK,2995269487.94,2.995,-28.94,2026-06-03,https://finance.yahoo.com/quote/TOM.OL/,63.0,0.0,63.0,2.4,,AI 2027/current overlay: no direct factor; bonus +2.4 after cap/YTD discipline.
US,44,TEX,Terex,United States,NYSE,65.3,Lifting/material handling,Low,High,15,14,12,12,9,1,6.747,30.7368,,"Aerial work, cranes and material-handling gear could benefit from accelerated industrial construction and automated logistics",No direct AI-specific supplier evidence found; industrial equipment and materials processing.,"Live US quote snapshot via finance tool, 2026-05-06 UTC",https://www.terex.com/,Industrial equipment,62.14,USD,6747000000.0,6.747,12.92,2026-06-03,https://finance.yahoo.com/quote/TEX/,61.0,0.0,61.0,4.3,physical_ai,AI 2027/current overlay: physical_ai; bonus +4.3 after cap/YTD discipline.
Non-US,46,EPI-A.ST,Epiroc,Sweden,Nasdaq Stockholm,64.6,Mining automation,Low,Medium,16,12,12,12,12,2,32.719,,Large,Mining automation and equipment could benefit if AI metals demand pushes harder on productivity and autonomy,No direct AI supply-chain supplier evidence found; mining and infrastructure equipment.,Qualitative valuation setup; no reliable non-US quote snapshot returned by finance tool,https://www.epirocgroup.com/,Industrial equipment,278.0,SEK,32718507394.88,32.719,32.25,2026-06-03,https://finance.yahoo.com/quote/EPI-A.ST/,62.0,0.0,62.0,2.6,physical_ai,AI 2027/current overlay: physical_ai; bonus +2.6 after cap/YTD discipline.
US,45,MSM,MSC Industrial Direct,United States,NYSE,64.5,MRO distribution,Low,High,16,15,14,11,9,1,6.247,28.1528,,"MRO distribution could capture fragmented, non-glamorous parts demand as AI infrastructure suppliers stretch lead times",No direct AI-specific positioning found; broad industrial MRO distribution.,"Live US quote snapshot via finance tool, 2026-05-06 UTC",https://www.mscdirect.com/,Distribution / MRO,116.145,USD,6247000000.0,6.247,35.3,2026-06-03,https://finance.yahoo.com/quote/MSM/,64.0,0.0,64.0,0.5,,AI 2027/current overlay: no direct factor; bonus +0.5 after cap/YTD discipline.
Non-US,47,BCVN.SW,Bucher Industries,Switzerland,SIX,64.0,Hydraulics/machinery,Low,High,15,16,15,10,9,1,12.64,,Mid,"Hydraulics and specialty machinery could support automated construction, industrial equipment and facility operations","No direct AI supply-chain evidence found; agricultural, hydraulic, glass and municipal machinery.",Qualitative valuation setup; no reliable non-US quote snapshot returned by finance tool,https://www.bucherindustries.com/,Industrial equipment,117.0,CHF,12640154861.27,12.64,13.26,2026-06-03,https://finance.yahoo.com/quote/BCVN.SW/,64.0,0.0,64.0,0.0,,AI 2027/current overlay: no direct factor; bonus +0.0 after cap/YTD discipline.
US,46,ROCK,Gibraltar Industries,United States,NASDAQ,61.9,Infrastructure products,Low,Medium,15,19,5,10,6,1,1.119,541.4286,,"Building, renewable and infrastructure products could be repurposed into non-obvious facility components",No direct AI-data-center supplier evidence found; building and infrastructure products.,"Live US quote snapshot via finance tool, 2026-05-06 UTC",https://www.gibraltar1.com/,Industrial equipment,37.24,USD,1119440823.0,1.119,-25.73,2026-06-03,https://finance.yahoo.com/quote/ROCK/,54.0,0.0,54.0,7.9,power_grid,AI 2027/current overlay: power_grid; bonus +7.9 after cap/YTD discipline.
US,47,DSGR,Distribution Solutions Group,United States,NASDAQ,61.8,Industrial distribution,Low,Medium,16,19,7,12,7,1,1.262,77.4167,,Specialty MRO and supply-chain services could become a picks-and-shovels aggregator for emerging AI-infrastructure components,No direct AI supplier evidence found; broad industrial distribution.,"Live US quote snapshot via finance tool, 2026-05-06 UTC",https://www.distributionsolutionsgroup.com/,Distribution / MRO,27.44,USD,1262000000.0,1.262,-2.14,2026-06-03,https://finance.yahoo.com/quote/DSGR/,60.0,0.0,60.0,1.8,,AI 2027/current overlay: no direct factor; bonus +1.8 after cap/YTD discipline.
US,48,RBC,RBC Bearings,United States,NYSE,60.8,Precision bearings,Low,Medium,18,11,6,12,12,2,17.91,73.0586,,High-reliability bearings and components could map to robotics/aerospace-grade automated manufacturing,No direct AI infrastructure supplier evidence found; aerospace/industrial bearing focus.,"Live US quote snapshot via finance tool, 2026-05-06 UTC",https://www.rbcbearings.com/,Motion / mechanical,590.53,USD,17910042144.0,17.91,28.71,2026-06-03,https://finance.yahoo.com/quote/RBC/,57.0,0.0,57.0,3.8,physical_ai,AI 2027/current overlay: physical_ai; bonus +3.8 after cap/YTD discipline.
Non-US,48,TIH.TO,Toromont,Canada,TSX,59.0,Equipment/service,Low,Medium,15,13,12,10,11,2,12.938,,Large,"Equipment distribution/service could support remote construction, logistics and energy projects around compute campuses",No direct AI infrastructure evidence found; equipment dealership and industrial refrigeration/service.,Qualitative valuation setup; no reliable non-US quote snapshot returned by finance tool,https://www.toromont.com/,Industrial equipment,226.35,CAD,12937653126.65,12.938,34.88,2026-06-03,https://finance.yahoo.com/quote/TIH.TO/,59.0,0.0,59.0,0.0,,AI 2027/current overlay: no direct factor; bonus +0.0 after cap/YTD discipline.
Non-US,49,REH.AX,Reece,Australia,ASX,58.5,Plumbing/HVAC distribution,Medium,Medium,17,13,11,10,10,3,5.998,,Large,Plumbing and HVAC distribution could become a local bottleneck aggregator for water-intensive compute sites,No direct AI supplier evidence found; plumbing/HVAC distribution.,Qualitative valuation setup; no reliable non-US quote snapshot returned by finance tool,https://www.reecegroup.com.au/,Distribution / MRO,13.78,AUD,5998486250.9,5.998,3.3,2026-06-03,https://finance.yahoo.com/quote/REH.AX/,58.0,0.0,58.0,0.5,,AI 2027/current overlay: no direct factor; bonus +0.5 after cap/YTD discipline.
US,49,GTLS,Chart Industries,United States,NYSE,58.0,Cryogenic/gas systems,Medium,Medium,20,12,3,14,9,6,9.944,256.4938,,"Cryogenic, gas and process systems could become relevant if compute campuses adopt novel energy/cooling/gas-handling approaches","No direct AI infrastructure supplier evidence found in spot checks, but energy/cooling adjacency is high.","Live US quote snapshot via finance tool, 2026-05-06 UTC",https://www.chartindustries.com/,Water / fluid systems,207.46,USD,9944000000.0,9.944,0.6,2026-06-03,https://finance.yahoo.com/quote/GTLS/,52.0,0.0,52.0,6.0,power_grid,AI 2027/current overlay: power_grid; bonus +6.0 after cap/YTD discipline.
US,50,KWR,Quaker Houghton,United States,NYSE,56.0,Industrial fluids,Medium,Medium,18,16,4,12,9,4,2.475,545.6154,,"Process fluids, lubricants and surface-treatment chemistry could support high-throughput metalworking or coolant-adjacent niches",No direct AI-data-center/fab supplier positioning found in spot checks; industrial process fluids focus.,"Live US quote snapshot via finance tool, 2026-05-06 UTC",https://www.quakerhoughton.com/,Materials / chemicals,142.355,USD,2474891934.0,2.475,2.44,2026-06-03,https://finance.yahoo.com/quote/KWR/,55.0,0.0,55.0,1.0,,AI 2027/current overlay: no direct factor; bonus +1.0 after cap/YTD discipline.
Non-US,50,GURN.SW,Gurit,Switzerland,SIX,47.4,Composites,Low,Medium,17,18,14,12,6,1,0.224,,Small,"Composite materials expertise could support lightweight structures, enclosures and advanced manufacturing cells",No direct AI infrastructure evidence found; composites for wind/marine/industrial applications.,Qualitative valuation setup; no reliable non-US quote snapshot returned by finance tool,https://www.gurit.com/,Materials / chemicals,36.8,CHF,224050925.77,0.224,211.86,2026-06-03,https://finance.yahoo.com/quote/GURN.SW/,66.0,8.1,57.9,-10.5,,AI 2027/current overlay: no direct factor; bonus -10.5 after cap/YTD discipline.
