Region,Rank in Region,Ticker,Company,Country,Exchange,Alpha Score,Theme,Current AI Chain Risk,Evidence Confidence,Latent Fit,Discovery Gap,Valuation Setup,Catalyst Density,Execution/Quality,Hype Penalty,Market Cap USD bn,PE Ratio,Market Cap Tier,Latent AI Pathway,Current AI Supply-Chain Screen,Valuation Note,Source URL,Bucket,Latest Price,Latest Currency,Latest Market Cap USD,Latest Market Cap USD bn,Latest YTD Return %,Market Data As Of,Market Data Source,Base Alpha Score,Price Rerating Penalty Score,AI2027 Price Adjusted Score,AI2027 Trend Bonus Score,AI2027 Trend Tags,AI2027 Trend Note
US,1,TWIN,Twin Disc,United States,NASDAQ,87.0,Power transmission,Low,High,17,20,20,13,8,1,0.257,12.06,,"Transmissions, clutches and control systems could benefit from robotics, automation and specialty cooling machinery spillovers",No direct AI infrastructure evidence found; marine/off-highway/industrial power transmission focus.,"Live US quote snapshot via finance tool, 2026-05-06 UTC",https://www.twindisc.com/,Motion / mechanical,17.865,USD,257447000.0,0.257,10.28,2026-06-03,https://finance.yahoo.com/quote/TWIN/,77.0,0.0,77.0,10.0,"physical_ai,power_grid","AI 2027/current overlay: physical_ai,power_grid; bonus +10.0 after cap/YTD discipline."
Non-US,1,PWH.AX,PWR Holdings,Australia,ASX,86.0,Thermal systems,Medium,Medium,23,18,15,18,10,5,0.675,,Small/mid,Motorsport/aerospace heat exchangers and electronics cooling could be repurposed before data-center buyers discover them,"No current AI/data-center cooling positioning found in spot checks; official source emphasizes motorsport, automotive, emerging tech, aerospace/defence.",Qualitative valuation setup; no reliable non-US quote snapshot returned by finance tool,https://www.pwr.com.au/,Thermal / heat transfer,9.22,AUD,675163534.94,0.675,16.71,2026-06-03,https://finance.yahoo.com/quote/PWH.AX/,79.0,0.0,79.0,7.0,power_grid,AI 2027/current overlay: power_grid; bonus +7.0 after cap/YTD discipline.
US,2,BRC,Brady,United States,NYSE,84.3,Asset ID/safety,Low,High,16,18,20,11,12,0,4.124,9.4543,,"Industrial labels, safety identification and asset tracking could become more valuable in dense robotic/data-center operations",No direct AI supply-chain positioning found; identification and workplace safety products.,"Live US quote snapshot via finance tool, 2026-05-06 UTC",https://www.bradyid.com/,Security / safety,87.64,USD,4123782507.0,4.124,11.43,2026-06-03,https://finance.yahoo.com/quote/BRC/,77.0,0.0,77.0,7.3,"physical_ai,security_sovereign","AI 2027/current overlay: physical_ai,security_sovereign; bonus +7.3 after cap/YTD discipline."
US,3,BMI,Badger Meter,United States,NYSE,82.4,Flow/water telemetry,Medium,High,22,16,15,15,12,5,3.667,27.9977,,Smart water metering + flow measurement could monitor liquid cooling water loops and water intensity,No direct AI/data-center/fab supplier evidence found in spot checks; official materials emphasize water utilities/C&I flow control.,"Live US quote snapshot via finance tool, 2026-05-06 UTC",https://www.badgermeter.com/,Water / fluid systems,128.36,USD,3666583159.0,3.667,-27.23,2026-06-03,https://finance.yahoo.com/quote/BMI/,75.0,0.0,75.0,7.4,power_grid,AI 2027/current overlay: power_grid; bonus +7.4 after cap/YTD discipline.
Non-US,2,BOY.L,Bodycote,United Kingdom,LSE,82.0,Heat treatment,Low,High,18,17,15,13,10,1,1.841,,Mid,"Thermal processing and specialty treatment could enable higher-spec metal components in liquid loops, robotics and industrial automation",No direct AI/fab/data-center supplier evidence found; heat-treatment services across industrial markets.,Qualitative valuation setup; no reliable non-US quote snapshot returned by finance tool,https://www.bodycote.com/,Manufacturing / tooling,818.5,GBp,1841082094.24,1.841,15.28,2026-06-03,https://finance.yahoo.com/quote/BOY.L/,72.0,0.0,72.0,10.0,"physical_ai,power_grid","AI 2027/current overlay: physical_ai,power_grid; bonus +10.0 after cap/YTD discipline."
Non-US,3,GHH.L,Gooch & Housego,United Kingdom,LSE,82.0,Specialty photonics,Medium,Medium,22,18,14,16,8,6,0.345,,Small,"Precision photonics outside data-center transceivers could become useful for sensing, inspection and quantum/edge infrastructure","No evidence found of CPO/datacenter transceiver supply; official source emphasizes industry, telecoms, aerospace, defense, space and life sciences.",Qualitative valuation setup; no reliable non-US quote snapshot returned by finance tool,https://gandh.com/,Sensors / electronics,922.0,GBp,345276233.81,0.345,49.19,2026-06-03,https://finance.yahoo.com/quote/GHH.L/,72.0,0.0,72.0,10.0,"compute_factory,packaging_memory_test","AI 2027/current overlay: compute_factory,packaging_memory_test; bonus +10.0 after cap/YTD discipline."
Non-US,4,NTG.DE,Nabaltec,Germany,Xetra,81.8,Ceramic fillers/materials,Low,High,20,19,15,14,8,2,0.119,,Small,"Specialty alumina, ceramic bodies and flame-retardant fillers could become valuable in thermal, safety and enclosure materials",No direct AI/fab/data-center evidence found; specialty chemicals/ceramics.,Qualitative valuation setup; no reliable non-US quote snapshot returned by finance tool,https://www.nabaltec.de/,Materials / chemicals,11.45,EUR,119443896.0,0.119,-8.03,2026-06-03,https://finance.yahoo.com/quote/NTG.DE/,74.0,0.0,74.0,7.8,power_grid,AI 2027/current overlay: power_grid; bonus +7.8 after cap/YTD discipline.
US,4,LNN,Lindsay,United States,NASDAQ,81.8,Water/irrigation telemetry,Low,High,18,19,20,14,10,1,1.18,16.3655,,"Irrigation automation, remote monitoring and water-efficiency systems could translate into scarce-water site management know-how",No direct AI supply chain evidence found; primarily irrigation and infrastructure equipment.,"Live US quote snapshot via finance tool, 2026-05-06 UTC",https://www.lindsay.com/,Water / fluid systems,112.56,USD,1180010799.0,1.18,-7.09,2026-06-03,https://finance.yahoo.com/quote/LNN/,80.0,0.0,80.0,1.8,,AI 2027/current overlay: no direct factor; bonus +1.8 after cap/YTD discipline.
US,5,AZZ,AZZ,United States,NYSE,79.5,Metal coatings/infrastructure,Low,High,19,17,20,15,10,2,4.098,13.5092,,"Hot-dip galvanizing and coil coating could protect steel structures, poles, enclosures and distributed infrastructure as compute becomes more physical",No direct AI-supplier positioning found in company spot checks; critical infrastructure coatings focus.,"Live US quote snapshot via finance tool, 2026-05-06 UTC",https://www.azz.com/,Materials / chemicals,136.59,USD,4097868689.0,4.098,24.47,2026-06-03,https://finance.yahoo.com/quote/AZZ/,79.0,0.0,79.0,0.5,,AI 2027/current overlay: no direct factor; bonus +0.5 after cap/YTD discipline.
Non-US,5,KSB.DE,KSB,Germany,Xetra,79.3,Pumps/valves,Medium,High,22,16,15,13,10,4,1.743,,Mid,Industrial pumps and valves could become critical as liquid cooling and water reuse component demand fragments,"No direct AI/data-center positioning found in spot checks; official source emphasizes pumps/valves for industry, energy, water and mining.",Qualitative valuation setup; no reliable non-US quote snapshot returned by finance tool,https://www.ksb.com/,Water / fluid systems,858.0,EUR,1742817680.11,1.743,-11.55,2026-06-03,https://finance.yahoo.com/quote/KSB.DE/,72.0,0.0,72.0,7.3,power_grid,AI 2027/current overlay: power_grid; bonus +7.3 after cap/YTD discipline.
Non-US,6,TTG.L,TT Electronics,United Kingdom,LSE,78.8,Rugged electronics,Medium,Medium,21,17,15,15,8,5,0.282,,Small/mid,"Sensors, power conversion and electronics assemblies for regulated markets could migrate to rugged edge/thermal-control niches","No direct AI data-center/fab supplier evidence found; official source emphasizes medical, aerospace, defence, automation and electrification.",Qualitative valuation setup; no reliable non-US quote snapshot returned by finance tool,https://www.ttelectronics.com/,Sensors / electronics,116.0,GBp,282472860.19,0.282,-1.69,2026-06-03,https://finance.yahoo.com/quote/TTG.L/,71.0,0.0,71.0,7.8,power_grid,AI 2027/current overlay: power_grid; bonus +7.8 after cap/YTD discipline.
Non-US,7,ROR.L,Rotork,United Kingdom,LSE,78.1,Flow control/actuators,Medium,High,21,16,15,14,11,4,3.327,,Mid,"Actuators and flow-control systems could fit coolant, water and industrial control loops",No direct AI infrastructure evidence found; flow-control products for industrial process markets.,Qualitative valuation setup; no reliable non-US quote snapshot returned by finance tool,https://www.rotork.com/,Other,307.2,GBp,3327391185.65,3.327,-5.59,2026-06-03,https://finance.yahoo.com/quote/ROR.L/,73.0,0.0,73.0,5.1,physical_ai,AI 2027/current overlay: physical_ai; bonus +5.1 after cap/YTD discipline.
US,6,TKR,Timken,United States,NYSE,77.8,Bearings/motion,Low,High,18,14,14,13,12,1,9.111,28.2979,,"Bearings and motion products could be used in robotics, automated warehouses, cooling equipment and specialty manufacturing",No direct AI supply chain positioning found; broad industrial and engineered bearings.,"Live US quote snapshot via finance tool, 2026-05-06 UTC",https://www.timken.com/,Motion / mechanical,131.045,USD,9111000000.0,9.111,51.87,2026-06-03,https://finance.yahoo.com/quote/TKR/,70.0,0.0,70.0,7.8,"physical_ai,power_grid","AI 2027/current overlay: physical_ai,power_grid; bonus +7.8 after cap/YTD discipline."
US,7,MWA,Mueller Water Products,United States,NYSE,77.5,Water infrastructure,Low,High,20,17,17,14,11,2,3.945,21.3701,,"Water distribution, leak detection and smart utility products could be relevant as AI campuses pressure municipal water networks",No direct AI/data-center revenue positioning found; mainly water infrastructure and utility products.,"Live US quote snapshot via finance tool, 2026-05-06 UTC",https://www.muellerwaterproducts.com/,Water / fluid systems,24.86,USD,3945000000.0,3.945,3.84,2026-06-03,https://finance.yahoo.com/quote/MWA/,77.0,0.0,77.0,0.5,,AI 2027/current overlay: no direct factor; bonus +0.5 after cap/YTD discipline.
US,8,CTS,CTS Corporation,United States,NYSE,77.5,Sensors/electronic components,Medium,High,21,18,15,13,10,4,1.908,25.641,,"Sensors, filters, and connectivity components could support edge sensing, thermal monitoring and industrial automation",No direct AI build-out/fab evidence found in spot checks; automotive/industrial electronics focus.,"Live US quote snapshot via finance tool, 2026-05-06 UTC",https://www.ctscorp.com/,Sensors / electronics,66.69,USD,1907718955.0,1.908,52.09,2026-06-03,https://finance.yahoo.com/quote/CTS/,73.0,0.0,73.0,4.5,power_grid,AI 2027/current overlay: power_grid; bonus +4.5 after cap/YTD discipline.
US,9,GGG,Graco,United States,NYSE,77.3,Fluid handling,Medium,High,23,14,13,14,12,5,12.617,26.2614,,"Precision equipment to move, meter, control and dispense fluids/powders could support future coolant, sealant or thermal-fluid handling",No direct AI infrastructure positioning found in spot checks; broad industrial fluid handling.,"Live US quote snapshot via finance tool, 2026-05-06 UTC",https://www.graco.com/,Water / fluid systems,74.06,USD,12617000000.0,12.617,-10.38,2026-06-03,https://finance.yahoo.com/quote/GGG/,71.0,0.0,71.0,6.3,power_grid,AI 2027/current overlay: power_grid; bonus +6.3 after cap/YTD discipline.
Non-US,8,STM.DE,Stabilus,Germany,Xetra,77.0,Motion control,Low,High,16,17,14,12,9,1,0.548,,Mid,"Gas springs, dampers and electromechanical motion could support robotics, server-handling aids and automation hardware",No direct AI infrastructure evidence found; motion control across automotive/industrial.,Qualitative valuation setup; no reliable non-US quote snapshot returned by finance tool,https://www.stabilus.com/,Motion / mechanical,19.34,EUR,548446555.8,0.548,-5.66,2026-06-03,https://finance.yahoo.com/quote/STM.DE/,67.0,0.0,67.0,10.0,"compute_factory,physical_ai","AI 2027/current overlay: compute_factory,physical_ai; bonus +10.0 after cap/YTD discipline."
US,10,ATRO,Astronics,United States,NASDAQ,76.5,Aerospace electronics/test,Low,Medium,18,18,14,13,6,1,3.047,-977.375,,"Aerospace power, lighting, connectivity and test systems could be adapted to rugged edge compute and high-reliability electronics niches",No direct AI build-out evidence found; aerospace/defense/test products.,"Live US quote snapshot via finance tool, 2026-05-06 UTC",https://www.astronics.com/,Sensors / electronics,85.01,USD,3047000000.0,3.047,50.17,2026-06-03,https://finance.yahoo.com/quote/ATRO/,68.0,0.0,68.0,8.5,"packaging_memory_test,power_grid","AI 2027/current overlay: packaging_memory_test,power_grid; bonus +8.5 after cap/YTD discipline."
US,11,CXT,Crane NXT,United States,NYSE,76.4,Security/authentication tech,Low,Medium,17,17,19,11,8,1,2.096,16.9074,,"Authentication, sensing and secure transaction technology could support access, trusted hardware and anti-counterfeit supply-chain needs",No direct AI supply-chain positioning found; payment/security/authentication technology.,"Live US quote snapshot via finance tool, 2026-05-06 UTC",https://www.cranenxt.com/,Security / safety,36.04,USD,2095693006.0,2.096,-24.49,2026-06-03,https://finance.yahoo.com/quote/CXT/,71.0,0.0,71.0,5.4,security_sovereign,AI 2027/current overlay: security_sovereign; bonus +5.4 after cap/YTD discipline.
Non-US,9,XTC.TO,Exco Technologies,Canada,TSX,76.0,Tooling/components,Low,High,17,19,15,12,7,1,0.208,,Small,"Die-casting tooling, extrusion tools and engineered components could support thermal housings and industrial reshoring","No direct AI infrastructure evidence found; tooling, die-casting and automotive components.",Qualitative valuation setup; no reliable non-US quote snapshot returned by finance tool,https://www.excocorp.com/,Manufacturing / tooling,7.92,CAD,207513194.97,0.208,15.96,2026-06-03,https://finance.yahoo.com/quote/XTC.TO/,69.0,0.0,69.0,7.0,power_grid,AI 2027/current overlay: power_grid; bonus +7.0 after cap/YTD discipline.
Non-US,10,BFSA.DE,Befesa,Luxembourg/Germany,Xetra,76.0,Metals recycling,Low,High,17,20,17,14,8,1,1.654,,Small/mid,Steel dust and aluminum residue recycling could matter as AI build-out increases metal circularity demand,No direct AI supplier evidence found; recycling of steel dust and aluminum salt slags.,Qualitative valuation setup; no reliable non-US quote snapshot returned by finance tool,https://www.befesa.com/,Recycling / critical materials,35.95,EUR,1654302516.47,1.654,19.99,2026-06-03,https://finance.yahoo.com/quote/BFSA.DE/,75.0,0.0,75.0,1.0,,AI 2027/current overlay: no direct factor; bonus +1.0 after cap/YTD discipline.
Non-US,11,KOMN.SW,Komax,Switzerland,SIX,76.0,Wire processing automation,Medium,Medium,18,16,14,13,8,3,0.362,,Small/mid,"Wire-processing automation could support high-volume harness manufacturing for robotics, power and industrial modules",No direct AI infrastructure evidence found; wire processing automation.,Qualitative valuation setup; no reliable non-US quote snapshot returned by finance tool,https://www.komaxgroup.com/,Manufacturing / tooling,56.1,CHF,362250481.12,0.362,-13.82,2026-06-03,https://finance.yahoo.com/quote/KOMN.SW/,66.0,0.0,66.0,10.0,"physical_ai,power_grid","AI 2027/current overlay: physical_ai,power_grid; bonus +10.0 after cap/YTD discipline."
Non-US,12,LEHN.SW,LEM Holding,Switzerland,SIX,75.8,Current sensing,Medium,Medium,20,16,13,14,9,5,0.665,,Small/mid,"Current and voltage sensors could become useful in high-voltage power monitoring and robotics, before AI-specific demand appears","No direct AI-data-center supplier evidence found; official source emphasizes current/voltage sensing for EV, grid, automation and power supplies.",Qualitative valuation setup; no reliable non-US quote snapshot returned by finance tool,https://www.lem.com/,Sensors / electronics,485.5,CHF,665353000.46,0.665,68.87,2026-06-03,https://finance.yahoo.com/quote/LEHN.SW/,67.0,0.0,67.0,8.8,"physical_ai,power_grid","AI 2027/current overlay: physical_ai,power_grid; bonus +8.8 after cap/YTD discipline."
Non-US,13,AMG.AS,AMG Critical Materials,Netherlands,Euronext Amsterdam,75.5,Critical materials,Medium,Medium,18,17,15,15,8,4,1.707,,Mid,"Vanadium, lithium and specialty materials could support energy storage/material bottlenecks adjacent to compute build-outs",No direct AI infrastructure supplier evidence found; critical materials and technologies.,Qualitative valuation setup; no reliable non-US quote snapshot returned by finance tool,https://amg-nv.com/,Recycling / critical materials,39.86,EUR,1707482806.75,1.707,34.75,2026-06-03,https://finance.yahoo.com/quote/AMG.AS/,69.0,0.0,69.0,6.5,power_grid,AI 2027/current overlay: power_grid; bonus +6.5 after cap/YTD discipline.
US,12,ODC,Oil-Dri,United States,NYSE,74.0,Sorbents/minerals,Low,High,16,20,20,11,8,0,1.118,19.8889,,"Engineered clay minerals/sorbents could be relevant to filtration, humidity control, spill management and facility resilience",No direct AI supply-chain positioning found; absorbent minerals and products.,"Live US quote snapshot via finance tool, 2026-05-06 UTC",https://www.oildri.com/,Materials / chemicals,76.88,USD,1117711739.0,1.118,58.68,2026-06-03,https://finance.yahoo.com/quote/ODC/,75.0,0.0,75.0,-1.0,,AI 2027/current overlay: no direct factor; bonus -1.0 after cap/YTD discipline.
Non-US,14,IMI.L,IMI,United Kingdom,LSE,74.0,Precision fluid control,Medium,Medium,21,14,12,14,12,5,8.72,,Large,"Precision valves and fluid-control systems could move into cooling, water treatment or industrial automation components",No direct AI infrastructure supplier evidence found; precision engineering across industrial sectors.,Qualitative valuation setup; no reliable non-US quote snapshot returned by finance tool,https://www.imiplc.com/,Water / fluid systems,2800.0,GBp,8719684764.8,8.72,12.0,2026-06-03,https://finance.yahoo.com/quote/IMI.L/,68.0,0.0,68.0,6.0,power_grid,AI 2027/current overlay: power_grid; bonus +6.0 after cap/YTD discipline.
Non-US,15,MELE.BR,Melexis,Belgium,Euronext Brussels,74.0,Automotive sensors,Medium,Medium,19,15,13,13,9,5,3.716,,Mid,"Magnetic/current/position sensor ICs for automotive could be repurposed for power and thermal sensing, but not AI accelerators",No direct AI data-center semiconductor evidence found; fabless sensors/driver ICs mostly automotive.,Qualitative valuation setup; no reliable non-US quote snapshot returned by finance tool,https://www.melexis.com/,Sensors / electronics,85.8,EUR,3716190037.92,3.716,46.04,2026-06-03,https://finance.yahoo.com/quote/MELE.BR/,64.0,0.0,64.0,10.0,"compute_factory,power_grid","AI 2027/current overlay: compute_factory,power_grid; bonus +10.0 after cap/YTD discipline."
US,13,SXI,Standex International,United States,NYSE,73.8,Sensors/magnetics/components,Medium,Medium,21,16,8,13,10,4,3.421,60.3386,,"Reed sensors, magnetics, electronics and hydraulics could be useful in liquid-cooling instrumentation and robotics",No direct AI/data-center/fab evidence found; diversified electronics/engraving/specialty solutions.,"Live US quote snapshot via finance tool, 2026-05-06 UTC",https://www.standex.com/,Sensors / electronics,287.475,USD,3421132823.0,3.421,27.85,2026-06-03,https://finance.yahoo.com/quote/SXI/,64.0,0.0,64.0,9.8,"physical_ai,power_grid","AI 2027/current overlay: physical_ai,power_grid; bonus +9.8 after cap/YTD discipline."
US,14,NGVT,Ingevity,United States,NYSE,73.5,Specialty chemicals/carbon,Low,Medium,17,18,14,12,7,1,2.314,-42.3207,,"Activated carbon and specialty materials could support filtration, adsorption, coatings or battery-adjacent infrastructure niches",No direct AI/data-center/fab evidence found; specialty chemicals/materials focus.,"Live US quote snapshot via finance tool, 2026-05-06 UTC",https://www.ingevity.com/,Materials / chemicals,67.075,USD,2314055969.0,2.314,11.62,2026-06-03,https://finance.yahoo.com/quote/NGVT/,67.0,0.0,67.0,6.5,power_grid,AI 2027/current overlay: power_grid; bonus +6.5 after cap/YTD discipline.
US,15,KMT,Kennametal,United States,NYSE,73.5,Cutting tools/materials,Low,High,18,16,13,12,9,1,2.503,30.2587,,Carbide tooling and wear-resistant materials could enable reshoring of precision thermal/mechanical components,No direct AI infrastructure exposure found; broad tooling and materials end-markets.,"Live US quote snapshot via finance tool, 2026-05-06 UTC",https://www.kennametal.com/,Manufacturing / tooling,32.98,USD,2503000000.0,2.503,13.76,2026-06-03,https://finance.yahoo.com/quote/KMT/,67.0,0.0,67.0,6.5,power_grid,AI 2027/current overlay: power_grid; bonus +6.5 after cap/YTD discipline.
Non-US,16,ELK.OL,Elkem,Norway,Oslo,73.5,Silicones/carbon materials,Medium,Medium,19,17,15,13,7,4,1.27,,Mid,"Silicones and carbon solutions could support thermal, sealing or battery-adjacent materials if demand spills outside incumbents","No direct AI/fab supply-chain evidence found in spot checks; silicones, silicon products and carbon solutions.",Qualitative valuation setup; no reliable non-US quote snapshot returned by finance tool,https://www.elkem.com/,Materials / chemicals,34.0,NOK,1269882933.24,1.27,11.18,2026-06-03,https://finance.yahoo.com/quote/ELK.OL/,67.0,0.0,67.0,6.5,power_grid,AI 2027/current overlay: power_grid; bonus +6.5 after cap/YTD discipline.
Non-US,17,NOEJ.DE,NORMA Group,Germany,Xetra,73.5,Fluid connectors/clamps,Medium,High,20,18,16,13,8,3,0.572,,Small/mid,"Engineered joining and fluid connectors could be used in liquid loops, compact manifolds and industrial automation",No direct AI-data-center supplier evidence found; industrial joining technology.,Qualitative valuation setup; no reliable non-US quote snapshot returned by finance tool,https://www.normagroup.com/,Water / fluid systems,17.46,EUR,572211410.8,0.572,18.61,2026-06-03,https://finance.yahoo.com/quote/NOEJ.DE/,72.0,0.0,72.0,1.5,,AI 2027/current overlay: no direct factor; bonus +1.5 after cap/YTD discipline.
US,16,DXPE,DXP Enterprises,United States,NASDAQ,73.5,Industrial distribution/pumps,Medium,Medium,18,18,13,12,9,3,2.422,34.4421,,"Distributor/integrator of pumps, rotating equipment and MRO could aggregate fragmented cooling/water components if demand spills over",No direct AI-specific supplier evidence found; broad industrial distribution.,"Live US quote snapshot via finance tool, 2026-05-06 UTC",https://www.dxpe.com/,Distribution / MRO,155.13,USD,2422000000.0,2.422,44.01,2026-06-03,https://finance.yahoo.com/quote/DXPE/,67.0,0.0,67.0,6.5,power_grid,AI 2027/current overlay: power_grid; bonus +6.5 after cap/YTD discipline.
US,17,AIT,Applied Industrial Technologies,United States,NYSE,73.3,Industrial distribution/motion,Medium,Medium,18,13,14,12,10,3,11.395,29.7819,,"Motion, bearings, flow control and automation distribution could aggregate latent demand before OEMs become obvious suppliers","No direct AI supplier evidence found; MRO, bearings, fluid power and automation distribution.","Live US quote snapshot via finance tool, 2026-05-06 UTC",https://www.applied.com/,Distribution / MRO,312.83,USD,11394996085.0,11.395,20.49,2026-06-03,https://finance.yahoo.com/quote/AIT/,64.0,0.0,64.0,9.3,"physical_ai,power_grid","AI 2027/current overlay: physical_ai,power_grid; bonus +9.3 after cap/YTD discipline."
Non-US,18,WJX.TO,Wajax,Canada,TSX,73.0,Industrial distribution,Low,High,16,18,15,11,7,1,0.455,,Small/mid,"Industrial equipment distribution could capture fragmented pumps, powertrain, MRO and service demand in secondary markets","No direct AI supplier evidence found; equipment, power systems and industrial components distribution.",Qualitative valuation setup; no reliable non-US quote snapshot returned by finance tool,https://www.wajax.com/,Distribution / MRO,29.435,CAD,454826123.16,0.455,6.49,2026-06-03,https://finance.yahoo.com/quote/WJX.TO/,66.0,0.0,66.0,7.0,power_grid,AI 2027/current overlay: power_grid; bonus +7.0 after cap/YTD discipline.
US,18,TRS,TriMas,United States,NASDAQ,73.0,Aerospace/packaging components,Low,Medium,16,18,20,11,8,1,1.432,1.7301,,"Specialty fasteners, aerospace components and closures could be redirected toward precision mechanical subassemblies",No direct AI build-out/fab evidence found; packaging/aerospace/specialty products.,"Live US quote snapshot via finance tool, 2026-05-06 UTC",https://www.trimascorp.com/,Industrial equipment,38.82,USD,1432390846.0,1.432,6.97,2026-06-03,https://finance.yahoo.com/quote/TRS/,72.0,0.0,72.0,1.0,,AI 2027/current overlay: no direct factor; bonus +1.0 after cap/YTD discipline.
Non-US,19,DSCV.L,discoverIE Group,United Kingdom,LSE,73.0,Custom electronics,Medium,High,20,18,15,14,9,4,0.985,,Small/mid,Custom electronic components for industrial sensing/control could be adapted for coolant sensing and edge device telemetry,No direct AI infrastructure/fab evidence found; custom electronics for industrial applications.,Qualitative valuation setup; no reliable non-US quote snapshot returned by finance tool,https://www.discoverieplc.com/,Sensors / electronics,786.0,GBp,985344610.01,0.985,32.99,2026-06-03,https://finance.yahoo.com/quote/DSCV.L/,72.0,0.0,72.0,1.0,,AI 2027/current overlay: no direct factor; bonus +1.0 after cap/YTD discipline.
US,19,HAYW,Hayward Holdings,United States,NYSE,72.3,Pumps/filtration,Low,High,17,18,17,11,9,1,3.016,20.4384,,"Pool pumps, controls and filtration capabilities could be adapted toward smaller liquid-management and heat-exchange niches",No direct AI/data-center/fab exposure found; consumer/commercial pool equipment focus.,"Live US quote snapshot via finance tool, 2026-05-06 UTC",https://www.hayward.com/,Water / fluid systems,13.865,USD,3016000000.0,3.016,-12.08,2026-06-03,https://finance.yahoo.com/quote/HAYW/,71.0,0.0,71.0,1.3,,AI 2027/current overlay: no direct factor; bonus +1.3 after cap/YTD discipline.
