theme,region,company,ticker,business_focus,headline_fact,why_it_fits,risk_watch,source_tags,latest_price,latest_currency,market_cap_usd_b,ytd_return_pct,market_data_as_of,market_data_source
Human / carbon-based consumption,US-based,Walmart,NYSE: WMT,"Scale retail, grocery, consumables, pharmacy",FY2026 revenue: $713B,"A broad proxy for recurring household spend, especially groceries, everyday goods, and pharmacy-led traffic.",Low-margin retail; mix shifts and consumer trade-down can change profit capture even if basket demand stays firm.,C1,131.6,USD,1049.00,16.71,2026-05-04,https://finance.yahoo.com/quote/WMT/
Human / carbon-based consumption,US-based,Eli Lilly,NYSE: LLY,Pharmaceuticals,FY2025 revenue: $65.2B,Direct proxy for one of the biggest current human-goods lines: pharmaceutical and medical-product consumption.,Concentration in a few blockbuster franchises and policy risk around drug pricing.,C2,963.33,USD,862.01,-10.83,2026-05-04,https://finance.yahoo.com/quote/LLY/
Human / carbon-based consumption,Non-US-based,Nestlé,SIX: NESN,"Packaged food, beverages, nutrition, pet care",2025 sales: CHF 89.5B,"A diversified way to express everyday food-and-beverage demand, with additional exposure to nutrition and pet categories.","FX, coffee/cocoa costs, and slower discretionary food categories.",C3,78.47,CHF,,2.66,2026-05-04,https://finance.yahoo.com/quote/NESN.SW/
Human / carbon-based consumption,Non-US-based,Novartis,SIX: NOVN / NYSE: NVS,Innovative pharmaceuticals,FY2025 net sales: $54.5B,Another direct proxy for the large and growing pharmaceutical component of the human consumption basket.,"Patent cliffs, pipeline execution, and reimbursement pressure.",C4,114.44,CHF,,5.47,2026-05-04,https://finance.yahoo.com/quote/NOVN.SW/
Silicon / AI-cluster consumption,US-based,NVIDIA,NASDAQ: NVDA,"Accelerators, AI systems, networking",FY2026 revenue: $215.9B; Data Center: $193.7B,The clearest listed proxy for the single largest silicon-basket bucket: high-end accelerators and AI-system demand.,"Customer concentration, export controls, and the pace of custom-ASIC substitution.",C5,198.45,USD,4851.00,5.08,2026-05-04,https://finance.yahoo.com/quote/NVDA/
Silicon / AI-cluster consumption,US-based,Broadcom,NASDAQ: AVGO,"Custom AI accelerators, AI networking, connectivity",Q1 FY2026 AI revenue: $8.4B (+106% YoY),Strong exposure to two fast-growing silicon needs at once: custom accelerators and AI networking/interconnect.,AI program concentration among a small number of hyperscale buyers.,C6 C10,421.28,USD,1995.00,21.19,2026-05-04,https://finance.yahoo.com/quote/AVGO/
Silicon / AI-cluster consumption,Non-US-based,TSMC,TWSE: 2330 / NYSE ADR: TSM,Leading-edge foundry,"2025 revenue: NT$3,809.05B; advanced nodes 77% of Q4 wafer revenue","A core manufacturing bottleneck for the compute-heavy side of the silicon basket, especially leading-edge AI chips.","Geopolitics, capex intensity, and cyclicality outside AI.",C7 C8,2275.0,TWD,,43.53,2026-05-04,https://finance.yahoo.com/quote/2330.TW/
Silicon / AI-cluster consumption,Non-US-based,SK hynix,KRX: 000660,HBM and AI memory,FY2025 revenue: 97.1467T won,Direct exposure to the fastest-growing memory layer in the silicon basket: HBM attached to AI accelerators.,Memory-price cyclicality and execution on next-generation HBM qualification.,C9,1447000.0,KRW,,113.74,2026-05-04,https://finance.yahoo.com/quote/000660.KS/
