rank,symbol,company,region,country,exchange,tier,alpha_score,component_score,market_cap_usd_bn,price,pe,direct_relationships_mapped,total_public_connections_mapped,verdict,revenue_streams,cash_in_summary,cash_out_summary,key_relationships,alpha_reason,risks,market_data_note,named7_rank
68,000660.KS,SK hynix,Non-US,South Korea,KRX,memory,55.1,78.3,998.269300,2555000.0,,34,51,Best named-seven alpha: direct HBM scarcity and record profitability; crowding rising after record share move.,"HBM, server DRAM, eSSD/NAND and specialty memory sold to cloud, OEM and accelerator supply chains.","Cash in from HBM/server DRAM/eSSD contracts, spot/contract pricing and OEM/cloud module demand.","Cash out to equipment makers, materials/wafer suppliers, fab construction, EUV/process tools and R&D.",MU (competes in HBM/DRAM); 005930.KS (competes in HBM/DRAM/NAND); NVDA (supplies memory ecosystem); 042700.KQ (HBM/package/test ecosystem); 042700.KQ (uses HBM packaging equipment ecosystem); NVMI (buys inspection/test/metrology); BESI.AS (HBM/package/test ecosystem); AMKR (HBM/package/test ecosystem); ASMI.AS (buys fab equipment); FORM (buys inspection/test/metrology); FORM (HBM/package/test ecosystem); ONTO (buys inspection/test/metrology),"HBM/server DRAM/eSSD leader with record profits and AI-led pricing power. Strong alpha, though recent share-price records mean the crowd is catching on.","Memory cyclicality, high expectations after share rally, HBM customer concentration, capex timing, competition from Samsung/Micron.","Reuters report: SK hynix record share price around KRW 1,447,000, value estimated from quoted USD price",1
51,MU,Micron Technology,US,United States,NASDAQ,memory,60.5,75.8,1217.000000,1073.88,30.2266,34,52,"Strong memory-cycle alpha: HBM/data-center mix, margin expansion and contracted supply make it a top named-seven candidate.","HBM, server DRAM, eSSD/NAND and specialty memory sold to cloud, OEM and accelerator supply chains.","Cash in from HBM/server DRAM/eSSD contracts, spot/contract pricing and OEM/cloud module demand.","Cash out to equipment makers, materials/wafer suppliers, fab construction, EUV/process tools and R&D.",000660.KS (competes in HBM/DRAM); 005930.KS (competes in HBM/DRAM/NAND); NVDA (supplies memory ecosystem); 042700.KQ (HBM/package/test ecosystem); NVMI (buys inspection/test/metrology); BESI.AS (HBM/package/test ecosystem); AMKR (HBM/package/test ecosystem); ASMI.AS (buys fab equipment); FORM (buys inspection/test/metrology); FORM (HBM/package/test ecosystem); ONTO (buys inspection/test/metrology); ONTO (HBM/package/test ecosystem),HBM and data-center memory cash flow with public revenue/margin acceleration and contracted HBM supply visibility; less crowded than GPU leaders but increasingly discovered.,"Memory cycle downturn, HBM share/pricing, capex intensity, China/geopolitical exposure, customer qualification risk.",finance tool: latest trade May 6 2026 UTC,2
47,005930.KS,Samsung Electronics,Non-US,South Korea,KRX,memory,61.8,71.9,1552.161091,310000.0,,35,87,"Improving AI linkage: HBM4/SOCAMM2 and foundry wins matter, but conglomerate scale dilutes pure-play alpha.","HBM, server DRAM, eSSD/NAND and specialty memory sold to cloud, OEM and accelerator supply chains.","Cash in from HBM/server DRAM/eSSD contracts, spot/contract pricing and OEM/cloud module demand.","Cash out to equipment makers, materials/wafer suppliers, fab construction, EUV/process tools and R&D.",000660.KS (competes in HBM/DRAM/NAND); MU (competes in memory); AMD (supplies/partners for HBM4/DRAM and programmable logic manufacturing); NVDA (supplies memory/foundry ecosystem); 042700.KQ (HBM/package/test ecosystem); NVMI (buys inspection/test/metrology); BESI.AS (HBM/package/test ecosystem); AMKR (HBM/package/test ecosystem); ASMI.AS (buys fab equipment); FORM (HBM/package/test ecosystem); FORM (buys inspection/test/metrology); ONTO (HBM/package/test ecosystem),Memory rebound plus HBM4/SOCAMM2/NVIDIA Vera Rubin evidence and foundry optionality. Size and conglomerate complexity cap alpha despite improving AI linkage.,"HBM execution versus SK/Micron, foundry competitiveness vs TSMC, conglomerate governance, memory-cycle volatility.",Reuters reported Samsung market capitalization exceeded $1T on May 6 2026,3
25,AVGO,Broadcom,US,United States,NASDAQ,custom ASIC / interconnect,72.2,63.7,1830.000000,384.13,106.3085,34,82,"High-quality but less early: custom AI silicon and networking cash flow are real, valuation and concentration cap alpha.","Custom AI accelerators, SerDes/DSP, Ethernet/PCIe/CXL/optical connectivity, merchant data-center silicon.","Cash in from hyperscaler custom programs, data-center networking/optical connectivity and platform attach.","Cash out to foundries, OSATs, IP/EDA, substrates, inventory and R&D.",MRVL (competes in custom silicon/networking); AMKR (uses assembly/test ecosystem); NVDA (competes/coexists in AI data-center silicon); TSM (uses foundry capacity); ASX (uses assembly/test ecosystem); 005930.KS (uses/competes in AI silicon ecosystem); CRDO (customer/competitor ecosystem in AI connectivity); ALAB (competes/coexists in AI connectivity); 042700.KQ (uses packaging/test); BESI.AS (uses packaging/test); AMKR (uses packaging/test); FORM (uses test/metrology indirectly),"Custom AI accelerators, Ethernet networking and infrastructure software cash flow. Strong platform, but high market cap, customer concentration and visibility reduce early-alpha score.","Hyperscaler concentration, customer-program lumpiness, valuation, networking/custom ASIC competition, integration complexity.",finance tool: latest trade May 6 2026 UTC,4
66,AMD,Advanced Micro Devices,US,United States,NASDAQ,AI accelerator,56.3,73.7,854.109000,523.27,175.0049,28,75,"Selective alpha: better entry leverage than NVIDIA if Instinct/EPYC ramps convert, but execution risk is high.","Data-center GPUs/accelerators, systems, networking/software attach; revenue from hyperscalers/OEMs/cloud providers.","Cash in from hyperscalers, cloud providers, OEM/ODM server channels and enterprise AI system demand.","Cash out to foundries, memory suppliers, OSATs, substrates, ODMs, inventory commitments and R&D.",GFS (uses foundry capacity); 005930.KS (uses Samsung foundry/memory collaboration); 2449.TW (uses outsourced test services); 002156.SZ (uses ATMP joint-venture ecosystem); NVDA (competes in AI accelerators); TSM (uses foundry capacity); UMC (uses foundry capacity); 042700.KQ (uses packaging/test); BESI.AS (uses packaging/test); AMKR (uses packaging/test); FORM (uses test/metrology indirectly); 000660.KS (uses manufacturing capacity),Second-source AI accelerator and EPYC exposure with Meta/AWS/Google/Microsoft/Tencent deployments and Samsung HBM collaboration. Alpha depends on closing the software/platform gap and converting MI demand into margin.,"Software ecosystem, GPU supply, HBM availability, margin dilution, competitive response from NVIDIA/custom ASICs.",finance tool: latest trade May 6 2026 UTC,5
26,NVDA,NVIDIA,US,United States,NASDAQ,AI accelerator,71.0,67.7,4893.000000,202.366,48.1617,27,79,"Hold/compounder more than fresh alpha: extraordinary AI earnings power, but the market has already discovered it.","Data-center GPUs/accelerators, systems, networking/software attach; revenue from hyperscalers/OEMs/cloud providers.","Cash in from hyperscalers, cloud providers, OEM/ODM server channels and enterprise AI system demand.","Cash out to foundries, memory suppliers, OSATs, substrates, ODMs, inventory commitments and R&D.",000660.KS (buys memory); MU (buys memory); 005930.KS (uses foundry and memory supply); AMD (competes in AI accelerators); TSM (uses foundry capacity); 042700.KQ (uses packaging/test); BESI.AS (uses packaging/test); AMKR (uses assembly/test ecosystem); AMKR (uses packaging/test); FORM (uses test/metrology indirectly); 000660.KS (uses manufacturing capacity); 000660.KS (uses memory ecosystem),"AI cash-flow king with disclosed dependencies on TSMC/Samsung foundries and SK hynix/Micron/Samsung memory. Alpha is capped by megacap crowding, ETF ownership and very visible expectations.","Customer concentration, export controls, supply-chain bottlenecks, valuation/crowding, hyperscaler ASIC substitution.",finance tool: latest trade May 6 2026 UTC,6
97,INTC,Intel,US,United States,NASDAQ,foundry,33.1,73.4,672.479000,133.97,-180.25,29,46,"Turnaround option: foundry/packaging upside, but cash-flow evidence is weak versus losses and execution risk.","Wafer fabrication, specialty processes, advanced-node capacity and sometimes advanced packaging/base dies.","Cash in from wafer starts, long-term capacity agreements, advanced-node wafer pricing and specialty-node volume.","Cash out to equipment/material suppliers, fab construction, utilities, labor and process R&D.",AMD (competes in CPU/data-center compute); MU (historical/market peer relationship); ASX (uses/competes in packaging ecosystem); NVMI (buys inspection/test/metrology); ASMI.AS (buys fab equipment); FORM (buys inspection/test/metrology); ONTO (buys inspection/test/metrology); ACMR (buys fab equipment); 6857.T (buys inspection/test/metrology); 6488.TWO (buys materials); ENTG (buys materials); SOI.PA (buys materials),"Foundry and advanced-packaging option value, but external foundry revenue is still small and the segment is loss-making; alpha is turnaround rather than clean AI bottleneck exposure.","Foundry losses, node execution, capex intensity, customer adoption, balance-sheet/cash-flow stress.",finance tool: latest trade May 6 2026 UTC,7
