global_rank,region_rank,region,ticker,company,country,exchange,theme,latent_ai_asset,market_cap_bucket,ai_visibility,alpha_score,latent_fit,discovery_gap,valuation_gap,catalyst_density,execution_quality,hype_penalty,conviction,thesis,catalysts,risks,source_keys,latest_price,latest_currency,latest_market_cap_usd,latest_market_cap_usd_b,latest_ytd_return_pct,market_data_as_of,market_data_source,base_alpha_score,price_rerating_penalty_score
43,19,Non-US,INRN.SW,Interroll,Switzerland,SIX,Industrial Automation & Robotics,"Conveyor, sorter and material-flow systems",Mid,Latent,68.0,19,15,12,14,11,3,Medium,AI warehouse orchestration needs reliable physical flow; Interroll is a pick-and-shovel for logistics automation.,Warehouse automation recovery; sorter projects; robotics integration.,Cyclical capex; premium quality multiple; slow European demand.,M_IEA_POWER;M_MS_POWER;M_CBRE_DC;M_SP_GLOBAL_DC,1676.0,CHF,1714304425.2,1.714,-25.68,2026-05-07,https://finance.yahoo.com/quote/INRN.SW/,68.0,0.0
44,20,Non-US,BEAN.SW,Belimo Holding,Switzerland,SIX,Thermal & Water,"HVAC actuators, valves, sensors and meters",Large,Emerging,68.0,22,10,8,17,14,3,Medium,"Belimo is a superb HVAC control compounder with data-center relevance, but valuation and growing market awareness reduce alpha.",Data-center HVAC growth; U.S. building controls; energy-efficiency regulation.,Premium multiple; Swiss franc; crowd discovery.,M_IEA_POWER;M_MS_POWER;M_CBRE_DC;M_SP_GLOBAL_DC;BELIMO_AR,746.5,CHF,11394986480.86,11.395,-8.46,2026-05-07,https://finance.yahoo.com/quote/BEAN.SW/,68.0,0.0
45,25,US,VNT,Vontier,United States,NYSE,Sensors & Measurement,"Mobility infrastructure, diagnostics and field-device networks",Mid,Latent,68.0,18,17,15,12,8,2,Speculative,"Vontier owns device networks and diagnostics in mobility/retail fueling that could become edge-data infrastructure, but the AI case is early and non-consensus.",EV charging/fleet infrastructure; diagnostics software; portfolio refocus.,Fueling end-market decline; debt; uncertain AI relevance.,M_IEA_POWER;M_MS_POWER;M_CBRE_DC;M_SP_GLOBAL_DC,35.04,USD,4979000000.0,4.979,-7.3,2026-05-07,https://finance.yahoo.com/quote/VNT/,68.0,0.0
46,26,US,MWA,Mueller Water Products,United States,NYSE,Thermal & Water,"Water infrastructure valves, hydrants and monitoring",Mid,Latent,68.0,18,16,13,13,10,2,Medium,"Data-center and municipal water stress makes resilient pipes, valves and monitoring more strategic than the market usually assumes.",Municipal capex; leak detection; industrial water projects.,Municipal funding cycle; execution; indirect AI link.,M_IEA_POWER;M_MS_POWER;M_CBRE_DC;M_SP_GLOBAL_DC,27.14,USD,4244000000.0,4.244,13.37,2026-05-07,https://finance.yahoo.com/quote/MWA/,68.0,0.0
47,21,Non-US,ALFA.ST,Alfa Laval,Sweden,Nasdaq Stockholm,Thermal & Water,"Heat exchangers, separation and fluid-handling systems",Large,Emerging,68.0,22,10,9,17,13,3,Medium,"Heat exchangers and fluid handling are critical to cooling and energy efficiency, but Alfa Laval is a large quality industrial already seeing data-center attention.",Data-center orders; heat-transfer capex; service growth.,Valuation; marine/energy cycles; large-cap discovery.,M_IEA_POWER;M_MS_POWER;M_CBRE_DC;M_SP_GLOBAL_DC;ALFA_AR,564.0,SEK,24468099461.9,24.468,20.41,2026-05-07,https://finance.yahoo.com/quote/ALFA.ST/,68.0,0.0
48,27,US,ZBRA,Zebra Technologies,United States,NASDAQ,Sensors & Measurement,"Barcode/RFID, machine vision and warehouse data capture",Large,Latent,67.0,20,14,12,14,10,3,Medium,"AI needs clean operational data; Zebra supplies identity, tracking and machine-vision endpoints, but warehouse spending must recover.",Retail/logistics refresh; machine vision; RFID and workflow data.,Retail capex; premium valuation; hardware cyclicality.,M_IEA_POWER;M_MS_POWER;M_CBRE_DC;M_SP_GLOBAL_DC,229.76,USD,10982181024.0,10.982,-7.47,2026-05-07,https://finance.yahoo.com/quote/ZBRA/,67.0,0.0
49,22,Non-US,AUTO.OL,AutoStore Holdings,Norway,Oslo,Industrial Automation & Robotics,Cube-storage robotics for warehouses,Mid,Emerging,67.0,21,12,11,15,9,1,Medium,Robotic cube storage becomes more valuable with AI orchestration; the stock’s prior derating creates asymmetry but competition remains intense.,Warehouse automation rebound; software optimization; retail/logistics projects.,Competition; patent/technology risk; project delays.,M_IEA_POWER;M_MS_POWER;M_CBRE_DC;M_SP_GLOBAL_DC,13.28,NOK,4393329685.53,4.393,10.21,2026-05-07,https://finance.yahoo.com/quote/AUTO.OL/,67.0,0.0
50,28,US,NOVT,Novanta,United States,NASDAQ,Sensors & Measurement,"Precision motion, photonics and medical/industrial subsystems",Mid,Latent,67.0,20,14,10,14,12,3,Medium,Precision motion and photonics subsystems support robotics and automated equipment; quality is high but valuation reduces alpha.,Advanced manufacturing; medical robotics; photonics modules.,Valuation; industrial softness; acquisition integration.,M_IEA_POWER;M_MS_POWER;M_CBRE_DC;M_SP_GLOBAL_DC,138.9,USD,4494774097.0,4.495,24.98,2026-05-07,https://finance.yahoo.com/quote/NOVT/,67.0,0.0
51,23,Non-US,NEX.PA,Nexans,France,Euronext Paris,Power & Grid,Electrification cables and grid infrastructure,Mid-Large,Emerging,67.0,21,10,11,16,12,3,Medium,Electrification and grid cable scarcity can support AI data-center power buildout; Nexans is less obvious than some U.S. electrical names.,Grid cable demand; electrification margin mix; portfolio focus.,European utilities cycle; project risk; copper volatility.,M_IEA_POWER;M_MS_POWER;M_CBRE_DC;M_SP_GLOBAL_DC,165.2,EUR,8179113825.69,8.179,28.76,2026-05-07,https://finance.yahoo.com/quote/NEX.PA/,67.0,0.0
52,29,US,RRX,Regal Rexnord,United States,NYSE,Power & Components,"Motors, power transmission and automation components",Mid-Large,Latent,67.0,19,15,14,13,10,4,Medium,"Motors, drives and power transmission are needed in cooling, robotics and factory automation; Regal is more of a cyclical industrial synergy story than an AI story.",Industrial recovery; synergy delivery; data-center HVAC and automation demand.,Leverage; integration risk; cyclical end markets.,M_IEA_POWER;M_MS_POWER;M_CBRE_DC;M_SP_GLOBAL_DC,231.37,USD,15401254876.0,15.401,58.36,2026-05-07,https://finance.yahoo.com/quote/RRX/,67.0,0.0
53,24,Non-US,PRY.MI,Prysmian,Italy,Borsa Italiana,Power & Grid,"Power cables, fiber and grid interconnect infrastructure",Large,Emerging,67.0,22,9,10,17,12,3,Medium,"Cables are a core AI-era bottleneck across grid and fiber, but Prysmian is increasingly recognized as an electrification/data-center supplier.",Grid interconnections; fiber demand; EHV/HVDC projects.,Project execution; commodity prices; large-cap discovery.,M_IEA_POWER;M_MS_POWER;M_CBRE_DC;M_SP_GLOBAL_DC,145.95,EUR,42657748949.2,42.658,62.38,2026-05-07,https://finance.yahoo.com/quote/PRY.MI/,67.0,0.0
54,30,US,MOD,Modine Manufacturing,United States,NYSE,Thermal & Water,"Data-center cooling, chillers and thermal systems",Mid,Discovered,66.7,24,8,9,19,11,3,Medium,"The business has clear data-center cooling leverage, but the market now recognizes it; alpha depends on execution and whether cooling remains undersupplied.",AI infrastructure orders; spin/simplification; long-term customer agreements.,Crowd discovery; customer concentration; hyperscaler self-design risk.,M_IEA_POWER;M_MS_POWER;M_CBRE_DC;M_SP_GLOBAL_DC;MODINE_AI,274.22,USD,14322000000.0,14.322,94.74,2026-05-07,https://finance.yahoo.com/quote/MOD/,68.0,1.3
55,25,Non-US,IFX.DE,Infineon Technologies,Germany,Xetra,Power & Components,"Power semiconductors, microcontrollers and sensors",Large,Emerging,66.0,22,10,11,15,12,4,Medium,"Infineon’s power chips and controllers are essential to efficient power conversion and edge devices, but it is too large and known for maximum early alpha.",Data-center power supplies; industrial power semis; automotive recovery.,Auto/industrial weakness; valuation; China competition.,M_IEA_POWER;M_MS_POWER;M_CBRE_DC;M_SP_GLOBAL_DC,61.47,EUR,92770685846.48,92.771,60.64,2026-05-07,https://finance.yahoo.com/quote/IFX.DE/,66.0,0.0
56,31,US,POWL,Powell Industries,United States,NASDAQ,Power & Grid,Custom switchgear and electrical power distribution systems,Mid,Emerging,65.9,24,11,12,19,11,5,Medium,"Switchgear is a bottleneck in data-center power delivery; Powell has real exposure, but the stock has already had a large run, lowering fresh alpha.",Utility/commercial backlog; data-center electrical rooms; capacity expansion.,Cyclical orders; crowd discovery; margin normalization after record cycle.,M_IEA_POWER;M_MS_POWER;M_CBRE_DC;M_SP_GLOBAL_DC;POWELL_IR,320.3,USD,11673428972.0,11.673,172.58,2026-05-07,https://finance.yahoo.com/quote/POWL/,72.0,6.1
57,32,US,SPXC,SPX Technologies,United States,NYSE,Thermal & Water,"HVAC, cooling towers and detection/measurement",Mid-Large,Discovered,65.0,21,9,9,17,12,3,Medium,"Data-center HVAC exposure is real, but the market has increasingly identified SPX as a cooling beneficiary, lowering discovery upside.",HVAC backlog; data-center cooling demand; bolt-on acquisitions.,Crowd discovery; valuation; HVAC order normalization.,M_IEA_POWER;M_MS_POWER;M_CBRE_DC;M_SP_GLOBAL_DC;SPX_IR,212.74,USD,10650793848.0,10.651,4.66,2026-05-07,https://finance.yahoo.com/quote/SPXC/,65.0,0.0
58,33,US,TDY,Teledyne Technologies,United States,NYSE,Sensors & Measurement,"Imaging sensors, instrumentation and defense/aerospace electronics",Large,Latent,65.0,21,12,10,14,13,5,Medium,"Teledyne owns sensor/imaging assets that feed AI models in defense, industrial and scientific markets; size and valuation reduce early-alpha asymmetry.",Defense sensing; machine vision; scientific instrumentation recovery.,Large-cap discovery; valuation; government project timing.,M_IEA_POWER;M_MS_POWER;M_CBRE_DC;M_SP_GLOBAL_DC,644.13,USD,29842000000.0,29.842,24.16,2026-05-07,https://finance.yahoo.com/quote/TDY/,65.0,0.0
59,26,Non-US,5802.T,Sumitomo Electric,Japan,Tokyo,Connectivity & Photonics,"Optical fiber, wire harnesses and power infrastructure",Large,Emerging,65.0,22,10,12,15,11,5,Medium,"A broad Japanese supplier of fiber and electrification hardware; AI campus fiber research helps, but conglomerate complexity tempers upside.",Multicore fiber; grid/automotive recovery; telecom demand.,Conglomerate discount; auto exposure; discovery after fiber news.,M_IEA_POWER;M_MS_POWER;M_CBRE_DC;M_SP_GLOBAL_DC;SUMITOMO_IR,11345.0,JPY,49415630901.12,49.416,69.08,2026-05-07,https://finance.yahoo.com/quote/5802.T/,65.0,0.0
60,34,US,KEYS,Keysight Technologies,United States,NYSE,Sensors & Measurement,Electronic design/test and network emulation,Large,Emerging,64.8,22,11,10,16,12,6,Medium,"AI hardware and networks need test/validation; Keysight is a high-quality tollbooth, but the market already understands its semicap/test role.",800G/1.6T; chip design validation; telecom recovery.,Valuation; cyclicality; already institutionally owned.,M_IEA_POWER;M_MS_POWER;M_CBRE_DC;M_SP_GLOBAL_DC,366.68,USD,62887000000.0,62.887,77.49,2026-05-07,https://finance.yahoo.com/quote/KEYS/,65.0,0.2
61,27,Non-US,6845.T,Azbil,Japan,Tokyo,Thermal & Water,"Building automation, measurement/control and lifeline systems",Large,Latent,64.0,20,13,10,15,12,6,Medium,"Building automation and control systems are key to efficient data-center/facility operations, but Azbil is still mostly valued as a Japanese control company.",Building automation; lifeline metering; energy efficiency retrofits.,Japan large-cap valuation; divestment effects; indirect AI exposure.,M_IEA_POWER;M_MS_POWER;M_CBRE_DC;M_SP_GLOBAL_DC;AZBIL_IR,1448.5,JPY,4600498211.8,4.6,1.76,2026-05-07,https://finance.yahoo.com/quote/6845.T/,64.0,0.0
62,28,Non-US,6841.T,Yokogawa Electric,Japan,Tokyo,Industrial Automation & Robotics,"Industrial control, measurement and plant data systems",Large,Emerging,64.0,20,13,11,15,12,7,Medium,Industrial data/control systems become the interface for autonomous operations and industrial AI; Yokogawa is diversified and not a pure AI play.,Process automation upgrades; cybersecurity/DX; energy efficiency projects.,Oil/gas capex cyclicality; slow software mix; AI already mentioned in DX narrative.,M_IEA_POWER;M_MS_POWER;M_CBRE_DC;M_SP_GLOBAL_DC;YOKOGAWA_IR,5734.0,JPY,8814647224.4,8.815,11.12,2026-05-07,https://finance.yahoo.com/quote/6841.T/,64.0,0.0
63,29,Non-US,6965.T,Hamamatsu Photonics,Japan,Tokyo,Sensors & Measurement,"Photodetectors, imaging sensors and photonics modules",Mid-Large,Latent,64.0,22,14,12,13,10,7,Medium,"Photon detection is a raw-signal layer for scientific, medical, industrial and potential photonic AI systems; earnings pressure keeps enthusiasm muted.",Semiconductor instruments; LiDAR/scientific sensors; imaging recovery.,Weak operating profit; Japan photonics competition; premium history.,M_IEA_POWER;M_MS_POWER;M_CBRE_DC;M_SP_GLOBAL_DC;HAMAMATSU_IR,2140.0,JPY,3738087562.12,3.738,25.33,2026-05-07,https://finance.yahoo.com/quote/6965.T/,64.0,0.0
64,35,US,DY,Dycom Industries,United States,NYSE,Connectivity & Services,Fiber network construction and maintenance,Mid-Large,Emerging,64.0,20,11,12,16,9,4,Medium,AI-era distributed compute needs fiber backhaul; Dycom is a labor/capex execution play rather than a tech multiple story.,Fiber buildouts; carrier capex recovery; data-center interconnect demand.,Customer concentration; labor costs; carrier budget timing.,M_IEA_POWER;M_MS_POWER;M_CBRE_DC;M_SP_GLOBAL_DC,457.78,USD,13722702346.0,13.723,31.71,2026-05-07,https://finance.yahoo.com/quote/DY/,64.0,0.0
65,36,US,CGNX,Cognex,United States,NASDAQ,Industrial Automation & Robotics,Machine vision and industrial barcode systems,Mid,Emerging,64.0,21,11,11,14,10,3,Medium,Machine vision is an obvious industrial AI endpoint; the alpha comes only if factory automation capex recovers before the crowd returns.,Factory automation recovery; logistics vision; AI vision features.,Industrial capex; valuation; competitive vision software.,M_IEA_POWER;M_MS_POWER;M_CBRE_DC;M_SP_GLOBAL_DC,62.26,USD,9825425148.0,9.825,68.59,2026-05-07,https://finance.yahoo.com/quote/CGNX/,64.0,0.0
66,30,Non-US,DPLM.L,Diploma,United Kingdom,LSE,Distribution/Services,"Technical distribution in controls, seals and life sciences",Large,Emerging,63.0,18,11,8,15,13,2,Medium,"Windy City Wire and controls exposure touch data-center infrastructure, but Diploma’s high-quality compounder valuation reduces alpha.",Controls growth; specialist M&A; North America data-center distribution.,High multiple; M&A execution; UK/EU cyclical exposure.,M_IEA_POWER;M_MS_POWER;M_CBRE_DC;M_SP_GLOBAL_DC;DIPLOMA_IR,7160.0,GBp,12754626389.68,12.755,35.22,2026-05-07,https://finance.yahoo.com/quote/DPLM.L/,63.0,0.0
67,37,US,IESC,IES Holdings,United States,NASDAQ,Data Center Services,Electrical contracting and infrastructure services,Mid,Discovered,63.0,20,9,10,16,9,1,Medium,Electrical contracting is critical for data-center expansion; the small-cap angle is attractive but performance has already drawn attention.,Data-center electrical projects; residential/commercial mix shift; margin strength.,Labor constraints; project concentration; liquidity.,M_IEA_POWER;M_MS_POWER;M_CBRE_DC;M_SP_GLOBAL_DC,673.84,USD,13426000000.0,13.426,65.6,2026-05-07,https://finance.yahoo.com/quote/IESC/,63.0,0.0
68,38,US,AVT,Avnet,United States,NASDAQ,Distribution/Services,Electronic components distribution and design-chain services,Mid,Latent,63.0,18,17,16,10,8,6,Speculative,AI buildout eventually pulls broad component distribution; Avnet offers value/cycle exposure but lower strategic uniqueness.,Component inventory reset; AI-adjacent design wins; cash generation.,Low margins; inventory cycle; limited pricing power.,M_IEA_POWER;M_MS_POWER;M_CBRE_DC;M_SP_GLOBAL_DC,83.7,USD,6755000000.0,6.755,69.64,2026-05-07,https://finance.yahoo.com/quote/AVT/,63.0,0.0
69,39,US,CNM,Core & Main,United States,NYSE,Thermal & Water,"Water, wastewater and storm-drainage distribution",Mid,Latent,62.0,17,15,11,13,10,4,Medium,"Data-center water constraints could increase the value of water infrastructure distribution, but the AI linkage is indirect.",Municipal water capex; industrial water projects; bolt-on M&A.,Valuation; housing/municipal cycle; indirect AI exposure.,M_IEA_POWER;M_MS_POWER;M_CBRE_DC;M_SP_GLOBAL_DC,50.67,USD,9907000000.0,9.907,-5.13,2026-05-07,https://finance.yahoo.com/quote/CNM/,62.0,0.0
70,31,Non-US,VACN.SW,VAT Group,Switzerland,SIX,Semi/Advanced Materials,Vacuum valves for semiconductor equipment,Large,Emerging,62.0,22,9,8,16,13,6,Medium,"A dominant vacuum-valve supplier to semicap; strategically vital, but quality valuation and semicap discovery limit alpha.",Semicap capex recovery; advanced node intensity; service/aftermarket.,Premium valuation; chip capex cycle; large customer exposure.,M_IEA_POWER;M_MS_POWER;M_CBRE_DC;M_SP_GLOBAL_DC,615.2,CHF,23073372700.11,23.073,42.21,2026-05-07,https://finance.yahoo.com/quote/VACN.SW/,62.0,0.0
71,32,Non-US,IFCN.SW,INFICON,Switzerland,SIX,Sensors & Measurement,"Vacuum instrumentation, leak detection and process sensors",Mid-Large,Latent,62.0,20,13,9,15,13,8,Medium,Process sensors and leak detection are essential for fabs and high-reliability manufacturing; INFICON is high quality but expensive.,Semicap recovery; process-control intensity; industrial sensing.,Premium multiple; Swiss franc; cyclical semicap orders.,M_IEA_POWER;M_MS_POWER;M_CBRE_DC;M_SP_GLOBAL_DC,149.2,CHF,4743629208.76,4.744,43.19,2026-05-07,https://finance.yahoo.com/quote/IFCN.SW/,62.0,0.0
72,40,US,WCC,WESCO International,United States,NYSE,Distribution/Services,"Electrical, communications and utility distribution",Mid-Large,Emerging,62.0,20,12,12,15,10,7,Medium,"A distributor of electrical and communications parts can quietly benefit from data-center/grid builds, though leverage and scale make it less early.",Data-center electrical supply; utility modernization; broadband build.,Leverage; cyclicality; distributor margin pressure.,M_IEA_POWER;M_MS_POWER;M_CBRE_DC;M_SP_GLOBAL_DC,363.12,USD,17686000000.0,17.686,44.03,2026-05-07,https://finance.yahoo.com/quote/WCC/,62.0,0.0
73,33,Non-US,6645.T,OMRON,Japan,Tokyo,Industrial Automation & Robotics,"Sensing, control and factory automation",Large,Emerging,62.0,20,12,12,14,10,6,Medium,Factory automation can become an AI deployment layer; Omron’s restructuring creates turnaround optionality but the AI linkage is not hidden.,IAB recovery; sensor/control upgrades; restructuring benefits.,Japan automation cycle; China demand; execution risk.,M_IEA_POWER;M_MS_POWER;M_CBRE_DC;M_SP_GLOBAL_DC;OMRON_IR,6043.0,JPY,7032111149.47,7.032,51.23,2026-05-07,https://finance.yahoo.com/quote/6645.T/,62.0,0.0
74,41,US,ACM,AECOM,United States,NYSE,Data Center Services,Engineering/design for infrastructure and critical facilities,Large,Latent,61.0,17,14,11,13,12,6,Medium,Engineering and permitting capacity is a hidden bottleneck in power/data-center projects; AECOM is high quality but large and diversified.,Power/grid design; environmental permitting; data-center campus services.,Low direct AI mix; valuation; public-sector budget shifts.,M_IEA_POWER;M_MS_POWER;M_CBRE_DC;M_SP_GLOBAL_DC,83.92,USD,10850000000.0,10.85,-12.95,2026-05-07,https://finance.yahoo.com/quote/ACM/,61.0,0.0
75,42,US,MTZ,MasTec,United States,NYSE,Connectivity & Services,"Power, renewables, communications and civil infrastructure",Mid-Large,Emerging,61.0,20,11,12,16,9,6,Medium,"Grid, fiber and power construction are bottlenecks for AI campuses; MasTec is broad, cyclical and not a pure AI name.",Grid/fiber spending; renewable interconnect; data-center power access.,Project execution; leverage; labor and permitting.,M_IEA_POWER;M_MS_POWER;M_CBRE_DC;M_SP_GLOBAL_DC,433.28,USD,34237000000.0,34.237,90.33,2026-05-07,https://finance.yahoo.com/quote/MTZ/,62.0,1.0
76,34,Non-US,SMHN.DE,SÜSS MicroTec,Germany,Xetra,Semi/Advanced Materials,"Lithography, bonding and advanced packaging tools",Mid,Discovered,60.2,22,10,9,17,10,5,Medium,"Advanced packaging tools are important for AI chips, but SÜSS has already been pulled into the semicap AI screen.",Hybrid bonding; advanced packaging capex; memory/logic recovery.,Cyclical semicap orders; valuation; capacity execution.,M_IEA_POWER;M_MS_POWER;M_CBRE_DC;M_SP_GLOBAL_DC,88.4,EUR,1163790284.8,1.164,116.45,2026-05-07,https://finance.yahoo.com/quote/SMHN.DE/,63.0,2.8
77,43,US,HUBB,Hubbell,United States,NYSE,Power & Grid,Electrical and utility components,Large,Discovered,60.0,21,8,8,16,13,6,Medium,"Hubbell is a best-in-class utility/electrical supplier, but the electrification thesis is already widely owned.",Grid hardening; data-center electrical demand; utility capex.,Valuation; crowd discovery; rate-sensitive utility spending.,M_IEA_POWER;M_MS_POWER;M_CBRE_DC;M_SP_GLOBAL_DC,502.34,USD,26544538258.0,26.545,8.49,2026-05-07,https://finance.yahoo.com/quote/HUBB/,60.0,0.0
78,35,Non-US,6506.T,Yaskawa Electric,Japan,Tokyo,Industrial Automation & Robotics,"Servos, motion control and industrial robots",Large,Emerging,60.0,21,9,10,15,11,6,Medium,"Robots and servo drives are obvious beneficiaries of AI-enabled factories, but Yaskawa is a known automation cyclical.",Robotics recovery; motion-control demand; China capex rebound.,China industrial weakness; competition; valuation swings.,M_IEA_POWER;M_MS_POWER;M_CBRE_DC;M_SP_GLOBAL_DC,5973.0,JPY,9164611210.49,9.165,20.33,2026-05-07,https://finance.yahoo.com/quote/6506.T/,60.0,0.0
79,36,Non-US,2395.TW,Advantech,Taiwan,TWSE,Industrial Automation & Robotics,"Industrial computers, edge devices and IoT platforms",Large,Emerging,59.0,21,10,9,15,10,6,Medium,"Edge AI needs rugged industrial computers; Advantech is well positioned, but it is already a recognized edge-computing supplier.",Edge AI boxes; factory IoT; industrial PC cycle recovery.,Valuation; China/industrial demand; competition.,M_IEA_POWER;M_MS_POWER;M_CBRE_DC;M_SP_GLOBAL_DC,444.0,TWD,10909890915.0,10.91,54.97,2026-05-07,https://finance.yahoo.com/quote/2395.TW/,59.0,0.0
80,37,Non-US,LR.PA,Legrand,France,Euronext Paris,Power & Grid,"Electrical infrastructure, racks and building systems",Large,Discovered,58.0,21,7,8,16,13,7,Medium,"Data-center electrical and building systems are core to Legrand, but the market increasingly recognizes this exposure.",Data-center products; building electrification; energy efficiency.,Large-cap discovery; valuation; European construction cycle.,M_IEA_POWER;M_MS_POWER;M_CBRE_DC;M_SP_GLOBAL_DC,163.7,EUR,46644493848.93,46.644,28.09,2026-05-07,https://finance.yahoo.com/quote/LR.PA/,58.0,0.0
81,44,US,COHR,Coherent,United States,NYSE,Connectivity & Photonics,"Optical transceivers, lasers and advanced materials",Large,Discovered,57.8,24,6,7,17,10,6,Medium,"A real optical/laser AI infrastructure beneficiary, but far from undiscovered; alpha depends on sustained optical scarcity.",AI datacom transceivers; lasers; manufacturing leverage.,Debt; cyclicality; hype/expectation risk.,M_IEA_POWER;M_MS_POWER;M_CBRE_DC;M_SP_GLOBAL_DC,344.67,USD,64619000000.0,64.619,77.36,2026-05-07,https://finance.yahoo.com/quote/COHR/,58.0,0.2
82,45,US,STRL,Sterling Infrastructure,United States,NASDAQ,Data Center Services,"Site development, e-infrastructure and civil construction",Mid,Discovered,57.6,19,10,10,16,11,2,Medium,"A data-center site-prep and e-infrastructure beneficiary, but the market has started to discover the construction angle.",Data-center campus buildout; transportation/infrastructure backlog; margins.,Construction cyclicality; valuation rerating; project execution.,M_IEA_POWER;M_MS_POWER;M_CBRE_DC;M_SP_GLOBAL_DC,886.22,USD,27195000000.0,27.195,177.67,2026-05-07,https://finance.yahoo.com/quote/STRL/,64.0,6.4
83,38,Non-US,AIXA.DE,Aixtron,Germany,Xetra,Semi/Advanced Materials,Deposition equipment for compound semiconductors,Mid,Emerging,57.5,22,13,12,13,8,5,Speculative,"Compound semis can matter to efficient power/optics, but Aixtron remains tied to cyclical SiC/GaN expectations and investor swings.",SiC/GaN recovery; optoelectronics; data-center power devices.,Order volatility; China/EV cycles; technology concentration.,M_IEA_POWER;M_MS_POWER;M_CBRE_DC;M_SP_GLOBAL_DC,50.74,EUR,6381838896.54,6.382,159.01,2026-05-07,https://finance.yahoo.com/quote/AIXA.DE/,63.0,5.5
84,39,Non-US,010120.KS,LS Electric,South Korea,KRX,Power & Grid,"Switchgear, automation and power infrastructure",Large,Emerging,57.3,22,12,12,16,9,5,Medium,Korean electrical infrastructure supplier with data-center/grid optionality and less global coverage than U.S. peers.,Korea/Asia data-center power; grid automation; overseas expansion.,Korean market cyclicality; FX; discovery after transformer reratings.,M_IEA_POWER;M_MS_POWER;M_CBRE_DC;M_SP_GLOBAL_DC,318500.0,KRW,30600907239.0,30.601,223.35,2026-05-07,https://finance.yahoo.com/quote/010120.KS/,66.0,8.7
85,40,Non-US,ENR.DE,Siemens Energy,Germany,Xetra,Power & Grid,"Grid equipment, gas turbines and transmission systems",Large,Discovered,57.0,22,6,9,17,9,6,Medium,"AI power demand helps grid/turbine suppliers, but Siemens Energy has already rerated around grid and power scarcity.",Grid backlog; turbine demand; power-system bottlenecks.,Wind turnaround; valuation after rerating; project execution.,M_IEA_POWER;M_MS_POWER;M_CBRE_DC;M_SP_GLOBAL_DC,186.34,EUR,178082391435.98,178.082,51.74,2026-05-07,https://finance.yahoo.com/quote/ENR.DE/,57.0,0.0
86,41,Non-US,BESI.AS,BE Semiconductor Industries,Netherlands,Euronext Amsterdam,Semi/Advanced Materials,Die attach and hybrid bonding equipment,Large,Discovered,57.0,23,5,7,18,11,7,Medium,"BESI is structurally tied to advanced packaging for AI chips, but the market has long identified that thesis.",Hybrid bonding adoption; AI accelerator packaging; memory recovery.,Semicap cycle; high expectations; valuation.,M_IEA_POWER;M_MS_POWER;M_CBRE_DC;M_SP_GLOBAL_DC,261.1,EUR,23697593339.08,23.698,75.12,2026-05-07,https://finance.yahoo.com/quote/BESI.AS/,57.0,0.0
