global_rank,region_rank,region,ticker,company,country,exchange,theme,latent_ai_asset,market_cap_bucket,ai_visibility,alpha_score,latent_fit,discovery_gap,valuation_gap,catalyst_density,execution_quality,hype_penalty,conviction,thesis,catalysts,risks,source_keys,latest_price,latest_currency,latest_market_cap_usd,latest_market_cap_usd_b,latest_ytd_return_pct,market_data_as_of,market_data_source,base_alpha_score,price_rerating_penalty_score
1,1,US,BDC,Belden,United States,NYSE,Connectivity & IT/OT,"Industrial data networking, fiber/copper connectivity and edge infrastructure",Mid,Emerging,84.0,23,17,15,18,12,1,High,"A quiet backbone of IT/OT convergence: industrial networks, mission-critical data movement and fiber/copper links can become the data layer for edge AI and AI-era factories.",Factory data layer upgrades; data-center/network cabling demand; margin mix shift toward solutions.,Industrial cycle; inventory digestion; competition from larger network vendors.,M_IEA_POWER;M_MS_POWER;M_CBRE_DC;M_SP_GLOBAL_DC;BELDEN_IR,114.65,USD,4362121920.0,4.362,-2.68,2026-05-07,https://finance.yahoo.com/quote/BDC/,84.0,0.0
2,2,US,ENS,EnerSys,United States,NYSE,Power & Grid,"Batteries, UPS backup and stored-energy systems",Mid,Latent,84.0,22,18,16,17,12,1,High,"AI data centers need resilient power, ride-through and backup energy; EnerSys is a power reliability supplier that is not generally treated as an AI stock.",UPS refresh cycle; grid constraints; reserve-power margin expansion.,Lead/lithium input costs; telecom capex; execution on newer energy systems.,M_IEA_POWER;M_MS_POWER;M_CBRE_DC;M_SP_GLOBAL_DC;ENERSYS_IR,224.1,USD,8123885398.0,8.124,48.68,2026-05-07,https://finance.yahoo.com/quote/ENS/,84.0,0.0
3,1,Non-US,HPS.A.TO,Hammond Power Solutions,Canada,TSX,Power & Grid,Dry-type transformers and custom power-distribution equipment,Small-Mid,Emerging,83.2,23,17,16,18,12,2,High,"Small enough to remain underfollowed, but directly exposed to transformer shortages, electrification and data-centre expansion.",Transformer backlog; U.S. data-centre/custom-engineered demand; capacity expansion.,Transformer-cycle normalization; Canadian liquidity; input costs.,M_IEA_POWER;M_MS_POWER;M_CBRE_DC;M_SP_GLOBAL_DC;HAMMOND_IR,304.48,CAD,2660750000.0,2.661,87.37,2026-05-07,https://finance.yahoo.com/quote/HPS-A.TO/,84.0,0.8
4,3,US,ITRI,Itron,United States,NASDAQ,Power & Grid,"Smart meters, grid endpoints and utility data networks",Mid,Latent,82.0,22,17,15,17,12,1,High,The AI power bottleneck increases the value of granular grid telemetry; Itron owns installed endpoints and software needed for demand response and grid visibility.,AMI rollouts; utility resilience spending; water/energy analytics attach.,Utility procurement delays; hardware margins; project concentration.,M_IEA_POWER;M_MS_POWER;M_CBRE_DC;M_SP_GLOBAL_DC;ITRON_IR,82.97,USD,3697000000.0,3.697,-12.17,2026-05-07,https://finance.yahoo.com/quote/ITRI/,82.0,0.0
5,2,Non-US,VLX.L,Volex,United Kingdom,LSE AIM,Connectivity & Photonics,"High-speed copper interconnects, power cords and connectors",Small-Mid,Emerging,82.0,24,16,15,18,11,2,High,"A neglected AIM-listed cable/interconnect maker supplying 400G/800G/emerging 1.6T data-centre links, with diversified industrial and EV exposure.",1.6T interconnect adoption; hyperscale demand; operating margin target delivery.,Customer concentration; M&A leverage; UK small-cap discount.,M_IEA_POWER;M_MS_POWER;M_CBRE_DC;M_SP_GLOBAL_DC;VOLEX_DC;VOLEX_RESULTS,648.0,GBp,1479090264.68,1.479,56.9,2026-05-07,https://finance.yahoo.com/quote/VLX.L/,82.0,0.0
6,3,Non-US,TWEKA.AS,TKH Group,Netherlands,Euronext Amsterdam,Connectivity & Automation,"Vision systems, fiber/connectivity and electrification assets",Mid,Latent,80.0,22,17,15,16,11,1,High,"A Dutch portfolio of machine vision, connectivity and electrification assets; the planned separation can crystallize hidden AI-adjacent value.",Automation/electrification separation; non-core divestments; machine-vision recovery.,Portfolio complexity; European industrial softness; execution of separation.,M_IEA_POWER;M_MS_POWER;M_CBRE_DC;M_SP_GLOBAL_DC;TKH_IR,45.78,EUR,2113533669.89,2.114,22.8,2026-05-07,https://finance.yahoo.com/quote/TWEKA.AS/,80.0,0.0
7,4,US,ROG,Rogers,United States,NYSE,Semi/Advanced Materials,"Thermal, high-frequency and power-electronics materials",Small-Mid,Latent,80.0,22,18,16,15,10,1,High,"Materials that dissipate heat and route high-speed/power signals can matter to AI accelerators, power electronics and RF systems; sentiment remains cyclical and activist-sensitive.",Electronics recovery; activist pressure; thermal-interface and aerospace/defense demand.,Weak wireless/EV cycles; small scale; execution after management changes.,M_IEA_POWER;M_MS_POWER;M_CBRE_DC;M_SP_GLOBAL_DC;ROGERS_IR,140.59,USD,2509325535.0,2.509,52.87,2026-05-07,https://finance.yahoo.com/quote/ROG/,80.0,0.0
8,4,Non-US,CRL.MI,CAREL Industries,Italy,Borsa Italiana,Thermal & Water,HVAC/refrigeration controls and data-center cooling controls,Mid,Emerging,79.0,22,16,15,16,12,2,High,"Cooling controls can be the intelligence layer for high-density data centers, yet CAREL is still mostly viewed as HVAC/refrigeration automation.",U.S. HVAC strength; data-center controls; energy-efficiency regulation.,European cycle; family/controlled liquidity; competition from larger HVAC controls.,M_IEA_POWER;M_MS_POWER;M_CBRE_DC;M_SP_GLOBAL_DC;CAREL_IR,27.7,EUR,3609850558.77,3.61,15.66,2026-05-07,https://finance.yahoo.com/quote/CRL.MI/,79.0,0.0
9,5,Non-US,SENS.SW,Sensirion,Switzerland,SIX,Sensors & Measurement,"Flow, humidity, gas and environmental sensors",Small-Mid,Latent,79.0,21,17,14,16,12,1,High,"Environmental sensors are the measurement layer for cooling, HVAC, robotics and edge AI; Sensirion is a high-quality niche sensor company.",A2L/HVAC sensors; industrial sensing; medical/auto design wins.,Swiss franc; premium quality multiple; product-cycle timing.,M_IEA_POWER;M_MS_POWER;M_CBRE_DC;M_SP_GLOBAL_DC;SENSIRION_IR,71.9,CHF,1446936165.9,1.447,15.97,2026-05-07,https://finance.yahoo.com/quote/SENS.SW/,79.0,0.0
10,6,Non-US,XPP.L,XP Power,Singapore,LSE,Power & Components,"Power converters for semiconductor, healthcare and industrial equipment",Small,Latent,78.6,21,19,17,15,9,0,High,A turnaround power-converter specialist; AI semicap and industrial electrification can pull demand before the market fully trusts the recovery.,Semiconductor equipment recovery; debt reduction; margin rebuild after factory actions.,Balance-sheet sensitivity; cyclical orders; prior execution issues.,M_IEA_POWER;M_MS_POWER;M_CBRE_DC;M_SP_GLOBAL_DC;XPPOWER_IR,1884.0,GBp,668490356.81,0.668,110.74,2026-05-07,https://finance.yahoo.com/quote/XPP.L/,81.0,2.4
11,7,Non-US,DSCV.L,discoverIE Group,United Kingdom,LSE,Power & Components,Customised industrial electronics and sensors,Small-Mid,Latent,78.0,20,18,15,14,11,0,High,A custom electronics compounder with industrial sensing and power niches; it can quietly supply edge-AI and electrification applications without AI branding.,Order recovery; operating margin target upgrade; acquisitions.,UK small-cap discount; industrial cycle; M&A execution.,M_IEA_POWER;M_MS_POWER;M_CBRE_DC;M_SP_GLOBAL_DC;DISCOVERIE_IR,679.0,GBp,865549357.26,0.866,14.89,2026-05-07,https://finance.yahoo.com/quote/DSCV.L/,78.0,0.0
12,5,US,IPGP,IPG Photonics,United States,NASDAQ,Connectivity & Photonics,Fiber lasers and amplifiers for precision manufacturing,Mid,Latent,78.0,21,18,16,14,10,1,Medium,"Fiber lasers are not an AI model, but advanced manufacturing, photonics and sensor systems can pull IPG into AI-enabled industrial production.",Industrial capex recovery; laser welding/cutting automation; photonics optionality.,China competition; cyclical industrial demand; margin pressure.,M_IEA_POWER;M_MS_POWER;M_CBRE_DC;M_SP_GLOBAL_DC;IPGP_IR,101.94,USD,4327000000.0,4.327,36.21,2026-05-07,https://finance.yahoo.com/quote/IPGP/,78.0,0.0
13,6,US,OSIS,OSI Systems,United States,NASDAQ,Sensors & Security,"Inspection, imaging and security scanning systems",Mid,Latent,77.0,21,17,14,15,11,1,Medium,Security/scanning hardware creates high-value imaging data; AI inference can improve inspection throughput without OSI being priced as an AI platform.,Port/security modernization; defense and border spending; software attach.,Government-contract timing; export controls; backlog conversion.,M_IEA_POWER;M_MS_POWER;M_CBRE_DC;M_SP_GLOBAL_DC,240.27,USD,3960000000.0,3.96,-5.99,2026-05-07,https://finance.yahoo.com/quote/OSIS/,77.0,0.0
14,8,Non-US,AALB.AS,Aalberts,Netherlands,Euronext Amsterdam,Thermal & Water,"Hydronic flow control, precision components and surface technologies",Mid,Latent,77.0,21,16,15,15,12,2,Medium,Hydronic flow and thermal control are needed for efficient cooling; Aalberts offers niche industrial/building technologies at a non-AI multiple.,Hydronic HVAC/data-centre demand; portfolio focus; European recovery.,European building cycle; conglomerate discount; indirect AI exposure.,M_IEA_POWER;M_MS_POWER;M_CBRE_DC;M_SP_GLOBAL_DC,37.6,EUR,4496109352.4,4.496,31.84,2026-05-07,https://finance.yahoo.com/quote/AALB.AS/,77.0,0.0
15,7,US,ESE,ESCO Technologies,United States,NYSE,Sensors & Measurement,"RF shielding, filtration, test and utility solutions",Mid,Latent,76.0,20,17,15,15,11,2,Medium,"A niche measurement and shielding portfolio sits near electrification, defense electronics and test environments needed around higher-density compute.",Utility spending; aerospace/defense electronics; acquisition integration.,Niche end-market cyclicality; small-cap liquidity; multiple already quality-premium.,M_IEA_POWER;M_MS_POWER;M_CBRE_DC;M_SP_GLOBAL_DC,335.59,USD,8791598818.0,8.792,69.82,2026-05-07,https://finance.yahoo.com/quote/ESE/,76.0,0.0
16,9,Non-US,TTG.L,TT Electronics,United Kingdom,LSE,Power & Components,"Sensors, power conversion and electronics manufacturing",Small,Latent,75.0,20,18,16,13,8,0,Speculative,"A small UK electronics supplier that senses, powers and connects regulated-market devices; it is a hidden edge-AI component candidate.",Aerospace/defense power; medical electronics; automation/electrification wins.,Small scale; margins; UK liquidity.,M_IEA_POWER;M_MS_POWER;M_CBRE_DC;M_SP_GLOBAL_DC;TT_IR,119.4,GBp,279111022.52,0.279,1.19,2026-05-07,https://finance.yahoo.com/quote/TTG.L/,75.0,0.0
17,8,US,MRCY,Mercury Systems,United States,NASDAQ,Defense/Space/Edge,"Rugged edge processing, RF and mission-compute modules",Small-Mid,Latent,75.0,22,17,16,14,8,2,Speculative,Defense AI needs deployable compute and sensor processing; prior execution issues keep the crowd skeptical despite strategic relevance.,Defense electronics recovery; edge AI modules; operating turnaround.,Program delays; margin execution; balance-sheet and customer concentration.,M_IEA_POWER;M_MS_POWER;M_CBRE_DC;M_SP_GLOBAL_DC,91.66,USD,5504000000.0,5.504,20.56,2026-05-07,https://finance.yahoo.com/quote/MRCY/,75.0,0.0
18,10,Non-US,AMS.SW,ams-OSRAM,Austria,SIX,Sensors & Photonics,"Optical emitters, sensors and illumination components",Mid,Special Situation,74.7,22,18,17,14,7,2,Speculative,"Optical sensing/emitters can feed edge AI, robotics and datacom, while balance-sheet and consumer-cycle scars keep expectations low.",Portfolio deleveraging; optical sensing recovery; automotive/industrial design wins.,Debt; smartphone/auto cycles; execution and dilution risk.,M_IEA_POWER;M_MS_POWER;M_CBRE_DC;M_SP_GLOBAL_DC,16.72,CHF,1578422491.0,1.578,94.08,2026-05-07,https://finance.yahoo.com/quote/AMS.SW/,76.0,1.3
19,11,Non-US,MGAM.L,Morgan Advanced Materials,United Kingdom,LSE,Semi/Advanced Materials,"Thermal ceramics, carbon and technical ceramic materials",Small-Mid,Special Situation,74.0,21,18,16,13,8,2,Speculative,"Thermal ceramics and semiconductor materials are relevant to power/heat constraints, but the market is focused on weak semicap/European industrial demand.",Semiconductor stabilization; margin simplification; thermal products recovery.,Weak semicap demand; European industrial slowdown; restructuring risk.,M_IEA_POWER;M_MS_POWER;M_CBRE_DC;M_SP_GLOBAL_DC;MORGAN_IR,229.36,GBp,817374847.54,0.817,3.32,2026-05-07,https://finance.yahoo.com/quote/MGAM.L/,74.0,0.0
20,9,US,LFUS,Littelfuse,United States,NASDAQ,Power & Components,"Circuit protection, power semis and sensors",Mid,Latent,74.0,20,16,15,14,11,2,Medium,"Circuit protection and sensors become more important as data-center power density and edge devices scale, but LFUS is still viewed as a cyclical industrial/electronics compounder.",Power semiconductor recovery; data-center protection products; industrial rebound.,Auto/industrial slowdown; channel destocking; acquisition execution.,M_IEA_POWER;M_MS_POWER;M_CBRE_DC;M_SP_GLOBAL_DC,441.67,USD,11113000000.0,11.113,68.23,2026-05-07,https://finance.yahoo.com/quote/LFUS/,74.0,0.0
21,12,Non-US,KARN.SW,Kardex,Switzerland,SIX,Industrial Automation & Robotics,"Warehouse automation, shuttle systems and light-goods robotics",Mid,Latent,73.0,20,15,12,16,11,1,Medium,"Warehouse automation becomes more AI-levered as orchestration software improves; Kardex is a focused automation asset, not an AI platform name.",Bookings momentum; lightgoods portfolio expansion; logistics automation cycle.,Capex pauses; premium quality valuation; customer project timing.,M_IEA_POWER;M_MS_POWER;M_CBRE_DC;M_SP_GLOBAL_DC;KARDEX_IR,282.0,CHF,2699921025.72,2.7,0.0,2026-05-07,https://finance.yahoo.com/quote/KARN.SW/,73.0,0.0
22,10,US,WTS,Watts Water Technologies,United States,NYSE,Thermal & Water,"Valves, sensors and water/thermal controls",Mid,Latent,73.0,20,16,13,15,11,2,Medium,AI data centers need water stewardship and thermal control; Watts is a quiet water/flow control compounder.,Data-center water constraints; smart valve/sensor adoption; building efficiency regulation.,Residential/non-residential cycle; premium valuation; raw-material costs.,M_IEA_POWER;M_MS_POWER;M_CBRE_DC;M_SP_GLOBAL_DC,291.99,USD,9678671434.0,9.679,4.81,2026-05-07,https://finance.yahoo.com/quote/WTS/,73.0,0.0
23,11,US,KN,Knowles,United States,NYSE,Sensors & Measurement,"MEMS microphones, capacitors and acoustic interfaces",Small,Latent,73.0,20,18,15,12,9,1,Speculative,Edge voice and sensor capture could become more valuable as AI moves to devices; Knowles remains a neglected component story.,Edge-AI devices; acoustic sensor wins; specialty capacitors.,Consumer electronics exposure; pricing pressure; slow design cycles.,M_IEA_POWER;M_MS_POWER;M_CBRE_DC;M_SP_GLOBAL_DC,33.96,USD,2731951873.0,2.732,54.72,2026-05-07,https://finance.yahoo.com/quote/KN/,73.0,0.0
24,13,Non-US,ATS.TO,ATS Corporation,Canada,TSX/NYSE,Industrial Automation & Robotics,Custom automation systems for advanced manufacturing,Mid,Latent,72.0,21,15,13,15,10,2,Medium,"Custom automation is the physical implementation layer for AI-enhanced factories, life sciences and energy manufacturing.",Order recovery; EV/battery and life-science projects; margin improvement.,Large project timing; leverage; industrial capex softness.,M_IEA_POWER;M_MS_POWER;M_CBRE_DC;M_SP_GLOBAL_DC;ATS_IR,46.49,CAD,3112616065.76,3.113,21.35,2026-05-07,https://finance.yahoo.com/quote/ATS.TO/,72.0,0.0
25,12,US,AZZ,AZZ Inc.,United States,NYSE,Power & Grid,Metal coatings and precoat metals for infrastructure,Mid,Latent,72.0,19,17,15,13,10,2,Medium,"AI data centers, substations and transmission all need protected metal infrastructure; AZZ is a second-derivative electrification pick.",Grid/industrial construction; galvanizing capacity; infrastructure spending.,Steel cycle; construction delays; less direct AI revenue linkage.,M_IEA_POWER;M_MS_POWER;M_CBRE_DC;M_SP_GLOBAL_DC;AZZ_IR,146.44,USD,4220593646.0,4.221,33.44,2026-05-07,https://finance.yahoo.com/quote/AZZ/,72.0,0.0
26,14,Non-US,OXIG.L,Oxford Instruments,United Kingdom,LSE,Semi/Advanced Materials,"Semiconductor, imaging, cryogenics and scientific tools",Small-Mid,Emerging,72.0,22,15,12,16,10,3,Medium,"Semiconductor, quantum and imaging tools give Oxford latent leverage to AI hardware R&D and advanced metrology without being a mainstream AI stock.",Semiconductor growth; cryogenic/quantum demand; imaging division recovery.,Research capex; China exposure; premium valuation.,M_IEA_POWER;M_MS_POWER;M_CBRE_DC;M_SP_GLOBAL_DC;OXFORD_IR,2964.0,GBp,2180021307.06,2.18,44.23,2026-05-07,https://finance.yahoo.com/quote/OXIG.L/,72.0,0.0
27,15,Non-US,RSW.L,Renishaw,United Kingdom,LSE,Sensors & Measurement,"Precision metrology, encoders and additive manufacturing",Mid-Large,Latent,72.0,21,15,12,15,12,3,Medium,AI-enabled manufacturing and robotics require precision measurement; Renishaw is strategic but often screened as a slow industrial metrology name.,Metrology recovery; robotics/automation design wins; additive manufacturing.,Industrial cycle; ownership structure; valuation.,M_IEA_POWER;M_MS_POWER;M_CBRE_DC;M_SP_GLOBAL_DC;RENISHAW_IR,5160.0,GBp,4713943065.95,4.714,45.35,2026-05-07,https://finance.yahoo.com/quote/RSW.L/,72.0,0.0
28,13,US,MKSI,MKS Instruments,United States,NASDAQ,Semi/Advanced Materials,"Vacuum, photonics, process control and advanced packaging tools",Mid,Emerging,72.0,22,14,13,16,11,4,Medium,"A foundational supplier to semiconductor manufacturing and packaging; less loved because of leverage/cycle concerns, but highly exposed to advanced-node capacity.",Semicap recovery; Atotech deleveraging/carve-out; packaging demand.,Debt load; chip-cycle swings; integration execution.,M_IEA_POWER;M_MS_POWER;M_CBRE_DC;M_SP_GLOBAL_DC,293.77,USD,19777000000.0,19.777,74.49,2026-05-07,https://finance.yahoo.com/quote/MKSI/,72.0,0.0
29,14,US,VSH,Vishay Intertechnology,United States,NYSE,Power & Components,"Passives, discretes, sensors and power components",Mid,Latent,72.0,20,18,17,13,9,2,Medium,AI power chains still need mundane passives and discretes; Vishay offers cheap cyclicality and broad power-component exposure.,Inventory normalization; power-electronics demand; buybacks/capital allocation.,Commodity pricing; sluggish auto/industrial cycles; lower structural margins.,M_IEA_POWER;M_MS_POWER;M_CBRE_DC;M_SP_GLOBAL_DC,33.56,USD,4568000000.0,4.568,119.49,2026-05-07,https://finance.yahoo.com/quote/VSH/,75.0,3.0
30,15,US,MTSI,MACOM Technology Solutions,United States,NASDAQ,Connectivity & Photonics,"RF, microwave, analog and optical semiconductors",Mid,Emerging,71.9,22,14,12,16,11,3,Medium,"MACOM sits in RF/optical signal chains that support high-speed networks and defense sensing, with less pure-AI crowding than the largest AI semis.",Optical/datacom components; defense RF demand; margin expansion.,Semiconductor cyclicality; valuation; customer concentration.,M_IEA_POWER;M_MS_POWER;M_CBRE_DC;M_SP_GLOBAL_DC,309.81,USD,23239000000.0,23.239,77.07,2026-05-07,https://finance.yahoo.com/quote/MTSI/,72.0,0.1
31,16,US,VIAV,VIAVI Solutions,United States,NASDAQ,Connectivity & Photonics,"Optical test, assurance and timing for networks/data centers",Small-Mid,Emerging,71.9,23,17,15,15,10,1,High,Every AI cluster and interconnect needs verification; VIAVI is a tollbooth on optical/network testing rather than a chip hype name.,800G/1.6T testing; telecom recovery; data-center ecosystem assurance.,Carrier capex weakness; acquisition integration; pricing pressure.,M_IEA_POWER;M_MS_POWER;M_CBRE_DC;M_SP_GLOBAL_DC;VIAVI_IR,53.0,USD,12397000000.0,12.397,192.01,2026-05-07,https://finance.yahoo.com/quote/VIAV/,79.0,7.1
32,17,US,BMI,Badger Meter,United States,NYSE,Sensors & Measurement,Smart water meters and flow instrumentation,Mid,Latent,71.0,19,16,10,15,13,2,Medium,Data-center water consumption makes measurement and leak detection valuable; Badger is a premium-quality sensor/utility data play.,Smart water adoption; municipal resilience budgets; software attach.,Valuation; municipal project timing; less direct AI monetization.,M_IEA_POWER;M_MS_POWER;M_CBRE_DC;M_SP_GLOBAL_DC,123.75,USD,3534080671.0,3.534,-29.84,2026-05-07,https://finance.yahoo.com/quote/BMI/,71.0,0.0
33,18,US,ATKR,Atkore,United States,NYSE,Power & Grid,"Electrical conduit, cable management and infrastructure products",Mid,Emerging,71.0,21,15,15,14,9,3,Medium,Conduit and cable management are banal but necessary in data centers and electrification builds; multiple compressed after normalization.,Electrical infrastructure projects; data-center/solar demand; portfolio simplification.,Pricing normalization; construction slowdown; commodity exposure.,M_IEA_POWER;M_MS_POWER;M_CBRE_DC;M_SP_GLOBAL_DC;ATKORE_IR,76.23,USD,2486396535.0,2.486,18.31,2026-05-07,https://finance.yahoo.com/quote/ATKR/,71.0,0.0
34,16,Non-US,MDA.TO,MDA Space,Canada,TSX,Defense/Space/Edge,"Satellite systems, robotics and geointelligence",Mid,Emerging,71.0,21,14,12,16,10,2,Medium,"Space data, robotics and geointelligence are high-value AI inputs; MDA is a public space/robotics asset with strong backlog but less U.S. investor coverage.",Satellite programs; Canadarm3/robotics; geointelligence data monetization.,Government program risk; space project execution; valuation after growth.,M_IEA_POWER;M_MS_POWER;M_CBRE_DC;M_SP_GLOBAL_DC;MDA_IR,44.0,CAD,4255472296.12,4.255,59.25,2026-05-07,https://finance.yahoo.com/quote/MDA.TO/,71.0,0.0
35,19,US,INTT,inTEST Corporation,United States,NYSE American,Semi/Advanced Materials,Thermal process and semiconductor test equipment,Micro-Small,Latent,70.3,21,19,16,13,7,2,Speculative,Tiny supplier of thermal/test capability: high optionality if AI chip packaging and burn-in/test demand broadens beyond the obvious semicap names.,Semicap recovery; advanced packaging test; operating leverage from small revenue base.,Microcap liquidity; customer concentration; cyclicality.,M_IEA_POWER;M_MS_POWER;M_CBRE_DC;M_SP_GLOBAL_DC,17.41,USD,232646520.0,0.233,130.9,2026-05-07,https://finance.yahoo.com/quote/INTT/,74.0,3.7
36,20,US,TRMB,Trimble,United States,NASDAQ,Sensors & Measurement,"Geospatial, positioning and construction data systems",Large,Latent,70.0,20,15,13,14,10,2,Medium,"AI models for construction, logistics and autonomy need precise geospatial data; Trimble has data and workflow positions but is not an AI narrative stock.",Construction automation; transportation optimization; subscription mix.,End-market cyclicality; portfolio complexity; software transition execution.,M_IEA_POWER;M_MS_POWER;M_CBRE_DC;M_SP_GLOBAL_DC,63.42,USD,14904000000.0,14.904,-19.03,2026-05-07,https://finance.yahoo.com/quote/TRMB/,70.0,0.0
37,21,US,APG,APi Group,United States,NYSE,Data Center Services,Fire/life safety and specialty services for critical facilities,Mid-Large,Emerging,70.0,18,15,13,15,11,2,Medium,"Safety, suppression and inspection services are mandatory in high-density data centers but usually ignored in AI supply-chain screens.",Data-center service contracts; inspection/monitoring digitization; margin expansion.,Labor costs; acquisition integration; commercial construction cycle.,M_IEA_POWER;M_MS_POWER;M_CBRE_DC;M_SP_GLOBAL_DC,46.32,USD,19871000000.0,19.871,18.86,2026-05-07,https://finance.yahoo.com/quote/APG/,70.0,0.0
38,17,Non-US,VCM.TO,Vecima Networks,Canada,TSX,Connectivity & Photonics,Cable/fiber access and cloud-native broadband platforms,Small,Latent,70.0,20,18,15,12,7,2,Speculative,"Distributed AI and edge compute need upgraded broadband/fiber access; Vecima is small, technical and underfollowed.",DOCSIS 4.0 rollouts; vCMTS adoption; customer transition from qualification to deployment.,Customer concentration; cable capex cycles; small-cap liquidity.,M_IEA_POWER;M_MS_POWER;M_CBRE_DC;M_SP_GLOBAL_DC;VECIMA_IR,13.25,CAD,236471583.58,0.236,27.4,2026-05-07,https://finance.yahoo.com/quote/VCM.TO/,70.0,0.0
39,22,US,SMTC,Semtech,United States,NASDAQ,Connectivity & Components,"LoRa, signal integrity and IoT connectivity chips/modules",Small-Mid,Emerging,70.0,21,15,14,14,8,2,Speculative,Edge AI needs low-power connectivity and telemetry; Semtech offers IoT and high-speed signal chain optionality after a difficult acquisition cycle.,LoRa ecosystem; data-center signal products; balance-sheet improvement.,Debt/integration; telecom/IoT cyclicality; execution risk.,M_IEA_POWER;M_MS_POWER;M_CBRE_DC;M_SP_GLOBAL_DC,119.19,USD,11098000000.0,11.098,58.37,2026-05-07,https://finance.yahoo.com/quote/SMTC/,70.0,0.0
40,23,US,FARO,FARO Technologies,United States,NASDAQ,Sensors & Measurement,"3D measurement, reality capture and industrial metrology",Small,Latent,70.0,21,18,15,12,7,3,Speculative,3D data capture is raw material for AI-enabled digital twins and robotics; the small-cap structure creates optionality and volatility.,Factory digital twins; public-safety mapping; operating leverage.,Small-cap losses/turnaround risk; competition; lumpy orders.,M_IEA_POWER;M_MS_POWER;M_CBRE_DC;M_SP_GLOBAL_DC,,,,,,,,70.0,0.0
41,18,Non-US,MTRS.ST,Munters Group,Sweden,Nasdaq Stockholm,Thermal & Water,Air and liquid cooling for data centers and industrial climate control,Mid,Discovered,69.0,24,8,10,19,12,4,Medium,"Munters has direct cooling exposure, but the data-center angle is now visible; upside depends on liquid-cooling scale and valuation discipline.",Liquid cooling; energy-efficient data-center orders; capacity expansion.,Crowd discovery; customer concentration; cooling-technology shifts.,M_IEA_POWER;M_MS_POWER;M_CBRE_DC;M_SP_GLOBAL_DC;MUNTERS_DC,209.9,SEK,4087504432.77,4.088,8.59,2026-05-07,https://finance.yahoo.com/quote/MTRS.ST/,69.0,0.0
42,24,US,GRC,Gorman-Rupp,United States,NYSE,Thermal & Water,"Pumps for industrial, municipal and dewatering applications",Small-Mid,Latent,69.0,18,18,15,12,8,2,Speculative,"Water movement and cooling-adjacent pumping can become a quiet data-center infrastructure need, while GRC remains a traditional industrial name.",Municipal infrastructure; cooling/water projects; margin recovery.,Industrial cyclicality; small scale; slower growth profile.,M_IEA_POWER;M_MS_POWER;M_CBRE_DC;M_SP_GLOBAL_DC,77.74,USD,2053132290.0,2.053,61.49,2026-05-07,https://finance.yahoo.com/quote/GRC/,69.0,0.0
