global_rank,region_rank,region,ticker,company,country,exchange,theme,latent_ai_asset,market_cap_bucket,ai_visibility,alpha_score,latent_fit,discovery_gap,valuation_gap,catalyst_density,execution_quality,hype_penalty,conviction,thesis,catalysts,risks,source_keys,latest_price,latest_currency,latest_market_cap_usd,latest_market_cap_usd_b,latest_ytd_return_pct,market_data_as_of,market_data_source,base_alpha_score,price_rerating_penalty_score
87,42,Non-US,ASM.AS,ASM International,Netherlands,Euronext Amsterdam,Semi/Advanced Materials,Atomic layer deposition and epitaxy equipment,Large,Discovered,56.0,23,5,6,18,12,8,Medium,"ASM is a crucial advanced-node tool supplier, but it is already viewed as an AI semicap beneficiary.",GAA/advanced nodes; ALD intensity; AI chip capex.,Valuation; cyclical orders; export restrictions.,M_IEA_POWER;M_MS_POWER;M_CBRE_DC;M_SP_GLOBAL_DC,874.6,EUR,46618828800.0,46.619,57.93,2026-05-07,https://finance.yahoo.com/quote/ASM.AS/,56.0,0.0
88,43,Non-US,2308.TW,Delta Electronics,Taiwan,TWSE,Power & Components,"Power supplies, thermal management and industrial automation",Mega,Discovered,55.4,23,6,7,17,13,7,Medium,"Delta is deeply relevant to data-center power and cooling, but it is no longer an undiscovered AI-infrastructure supplier.",AI server power; liquid cooling; industrial automation.,Crowd discovery; high expectations; Taiwan/geopolitical risk.,M_IEA_POWER;M_MS_POWER;M_CBRE_DC;M_SP_GLOBAL_DC,2280.0,TWD,183952823473.12,183.953,129.15,2026-05-07,https://finance.yahoo.com/quote/2308.TW/,59.0,3.6
89,46,US,CIEN,Ciena,United States,NYSE,Connectivity & Photonics,Optical networking systems and coherent technology,Mid-Large,Discovered,55.0,23,8,9,16,10,7,Medium,Optical transport is core to AI-era connectivity; Ciena is not a pure AI stock but the optical thesis is increasingly obvious.,800G/1.6T transport; cloud interconnect; telecom recovery.,Carrier capex; margin volatility; crowding into optical names.,M_IEA_POWER;M_MS_POWER;M_CBRE_DC;M_SP_GLOBAL_DC,576.79,USD,81557000000.0,81.557,134.41,2026-05-07,https://finance.yahoo.com/quote/CIEN/,59.0,4.0
90,44,Non-US,FN,Fabrinet,Cayman Islands / Thailand,NYSE,Connectivity & Photonics,Contract manufacturing for optical communications products,Large,Discovered,54.0,23,4,5,17,10,5,Medium,"Fabrinet makes optical equipment for AI/datacom supply chains, but it is already widely owned as an optical AI beneficiary.",800G/1.6T manufacturing; customer demand; margin stability.,Customer concentration; Thailand geopolitics/supply chain; crowding.,M_IEA_POWER;M_MS_POWER;M_CBRE_DC;M_SP_GLOBAL_DC,679.09,USD,24331000000.0,24.331,41.65,2026-05-07,https://finance.yahoo.com/quote/FN/,54.0,0.0
91,47,US,LITE,Lumentum,United States,NASDAQ,Connectivity & Photonics,"Optical components, lasers and photonics",Mid,Discovered,53.4,23,7,8,16,9,5,Medium,"Lumentum has clear AI datacom optics optionality, but investors increasingly screen for optical AI suppliers.",Datacom recovery; coherent optics; cloud transceiver demand.,Customer concentration; cyclicality; valuation if hype persists.,M_IEA_POWER;M_MS_POWER;M_CBRE_DC;M_SP_GLOBAL_DC,944.28,USD,64553000000.0,64.553,144.56,2026-05-07,https://finance.yahoo.com/quote/LITE/,58.0,4.6
92,45,Non-US,CLS.TO,Celestica,Canada,TSX/NYSE,Connectivity & Services,High-complexity electronics manufacturing and AI server supply chain,Large,Discovered,53.0,23,3,5,18,10,6,Medium,"Celestica has strong AI server exposure, but that is precisely why it is now a discovered trade.",Hyperscaler programs; networking/server mix; margin expansion.,Crowd discovery; customer concentration; inventory cycles.,M_IEA_POWER;M_MS_POWER;M_CBRE_DC;M_SP_GLOBAL_DC,564.36,CAD,43475554000.0,43.476,36.09,2026-05-07,https://finance.yahoo.com/quote/CLS.TO/,53.0,0.0
93,46,Non-US,5803.T,Fujikura,Japan,Tokyo,Connectivity & Photonics,"Optical fiber, cabling and data-center connectivity",Large,Discovered,52.6,24,2,4,18,12,5,Low,"Fujikura is a textbook example of an under-the-radar AI-infra supplier that the crowd has now discovered; useful as a control, not a fresh-alpha name.",Optical capacity; AI cluster cabling; factory expansion.,Massive rerating; expectation risk; fiber cycle.,M_IEA_POWER;M_MS_POWER;M_CBRE_DC;M_SP_GLOBAL_DC;FUJIKURA_REUTERS,6498.0,JPY,61539937671.17,61.54,111.37,2026-05-07,https://finance.yahoo.com/quote/5803.T/,55.0,2.4
94,47,Non-US,ABBN.SW,ABB,Switzerland,SIX,Power & Grid,"Electrification, drives, automation and robotics",Mega,Discovered,52.0,22,4,5,17,14,10,Low,"ABB is strategically relevant to electrification and automation, but it is too large, too covered and too explicitly linked to automation for early alpha.",Electrification backlog; drives/robotics; energy efficiency.,Mega-cap valuation; global cycle; crowd ownership.,M_IEA_POWER;M_MS_POWER;M_CBRE_DC;M_SP_GLOBAL_DC,82.6,CHF,188243254122.15,188.243,34.88,2026-05-07,https://finance.yahoo.com/quote/ABBN.SW/,52.0,0.0
95,48,US,AEHR,Aehr Test Systems,United States,NASDAQ,Semi/Advanced Materials,Wafer-level burn-in and test systems,Small,Emerging,51.7,21,15,15,12,6,3,Speculative,"Burn-in/test could matter for high-reliability SiC and power devices around data-center power, but customer concentration is high.",SiC recovery; AI power devices; new customer wins.,Customer concentration; sharp cyclicality; small-cap volatility.,M_IEA_POWER;M_MS_POWER;M_CBRE_DC;M_SP_GLOBAL_DC,96.73,USD,3042000000.0,3.042,336.51,2026-05-07,https://finance.yahoo.com/quote/AEHR/,66.0,14.3
96,49,US,WOLF,Wolfspeed,United States,NYSE,Power & Components,Silicon carbide power semiconductors and materials,Small,Special Situation,51.5,22,17,18,13,3,18,Speculative,"SiC power devices could support high-efficiency power conversion, but financial distress overwhelms the strategic optionality.",Restructuring; SiC demand recovery; asset monetization.,Balance sheet; dilution/bankruptcy risk; EV demand weakness.,M_IEA_POWER;M_MS_POWER;M_CBRE_DC;M_SP_GLOBAL_DC,43.08,USD,2082000000.0,2.082,127.58,2026-05-07,https://finance.yahoo.com/quote/WOLF/,55.0,3.5
97,48,Non-US,5801.T,Furukawa Electric,Japan,Tokyo,Connectivity & Photonics,Optical fiber/cable and electrical infrastructure,Mid-Large,Emerging,50.5,22,10,12,16,10,5,Medium,"Optical fiber and cable are key to AI clusters, but Japanese fiber names have begun to rerate; Furukawa is less crowded than Fujikura.",Optical products; telecom capex; data-center fiber capacity.,Currency; fiber pricing; crowd moving into Japan AI supply chain.,M_IEA_POWER;M_MS_POWER;M_CBRE_DC;M_SP_GLOBAL_DC;FURUKAWA_IR,46300.0,JPY,18544908191.42,18.545,339.28,2026-05-07,https://finance.yahoo.com/quote/5801.T/,65.0,14.5
98,49,Non-US,SIE.DE,Siemens,Germany,Xetra,Industrial Automation & Robotics,"Automation, digital industries and electrification software/hardware",Mega,Discovered,50.0,22,4,5,17,13,11,Low,Siemens owns many AI deployment layers but is already a core global industrial-automation compounder.,Digital Industries recovery; electrification; industrial software.,Large-cap discovery; industrial cycle; conglomerate complexity.,M_IEA_POWER;M_MS_POWER;M_CBRE_DC;M_SP_GLOBAL_DC,270.55,EUR,240988827506.23,240.989,12.21,2026-05-07,https://finance.yahoo.com/quote/SIE.DE/,50.0,0.0
99,50,Non-US,SU.PA,Schneider Electric,France,Euronext Paris,Power & Grid,"Energy management, data-center power and cooling infrastructure",Mega,Discovered,46.0,24,1,3,19,14,15,Low,"Schneider is a direct AI infrastructure winner, but the crowd has clearly found it; included as a negative-control for the alpha screen.",Data-center power/cooling demand; Southeast Asia buildout; services.,Crowded trade; premium valuation; no longer hidden.,M_IEA_POWER;M_MS_POWER;M_CBRE_DC;M_SP_GLOBAL_DC;M_SCHNEIDER_REUTERS,284.9,EUR,180555279213.77,180.555,20.19,2026-05-07,https://finance.yahoo.com/quote/SU.PA/,46.0,0.0
100,50,US,GLW,Corning,United States,NYSE,Connectivity & Photonics,"Fiber, optical connectivity and specialty glass",Large,Discovered,45.3,24,2,3,18,13,13,Low,The optical connectivity thesis is now mainstream after Nvidia/Corning news; GLW is strategically strong but not early alpha anymore.,AI fiber capacity expansion; hyperscaler deals; optical segment growth.,Major rerating already occurred; valuation; expectation risk.,M_IEA_POWER;M_MS_POWER;M_CBRE_DC;M_SP_GLOBAL_DC;M_CORNING_REUTERS,181.57,USD,156266000000.0,156.266,100.25,2026-05-07,https://finance.yahoo.com/quote/GLW/,47.0,1.7
