global_rank,region_rank,region,ticker,company,country,exchange,theme,latent_ai_asset,market_cap_bucket,ai_visibility,alpha_score,latent_fit,discovery_gap,valuation_gap,catalyst_density,execution_quality,hype_penalty,conviction,thesis,catalysts,risks,source_keys
1,1,Non-US,HPS.A.TO,Hammond Power Solutions,Canada,TSX,Power & Grid,Dry-type transformers and custom power-distribution equipment,Small-Mid,Emerging,84,23,17,16,18,12,2,High,"Small enough to remain underfollowed, but directly exposed to transformer shortages, electrification and data-centre expansion.",Transformer backlog; U.S. data-centre/custom-engineered demand; capacity expansion.,Transformer-cycle normalization; Canadian liquidity; input costs.,M_IEA_POWER;M_MS_POWER;M_CBRE_DC;M_SP_GLOBAL_DC;HAMMOND_IR
4,2,Non-US,VLX.L,Volex,United Kingdom,LSE AIM,Connectivity & Photonics,"High-speed copper interconnects, power cords and connectors",Small-Mid,Emerging,82,24,16,15,18,11,2,High,"A neglected AIM-listed cable/interconnect maker supplying 400G/800G/emerging 1.6T data-centre links, with diversified industrial and EV exposure.",1.6T interconnect adoption; hyperscale demand; operating margin target delivery.,Customer concentration; M&A leverage; UK small-cap discount.,M_IEA_POWER;M_MS_POWER;M_CBRE_DC;M_SP_GLOBAL_DC;VOLEX_DC;VOLEX_RESULTS
6,3,Non-US,XPP.L,XP Power,Singapore,LSE,Power & Components,"Power converters for semiconductor, healthcare and industrial equipment",Small,Latent,81,21,19,17,15,9,0,High,A turnaround power-converter specialist; AI semicap and industrial electrification can pull demand before the market fully trusts the recovery.,Semiconductor equipment recovery; debt reduction; margin rebuild after factory actions.,Balance-sheet sensitivity; cyclical orders; prior execution issues.,M_IEA_POWER;M_MS_POWER;M_CBRE_DC;M_SP_GLOBAL_DC;XPPOWER_IR
7,4,Non-US,TWEKA.AS,TKH Group,Netherlands,Euronext Amsterdam,Connectivity & Automation,"Vision systems, fiber/connectivity and electrification assets",Mid,Latent,80,22,17,15,16,11,1,High,"A Dutch portfolio of machine vision, connectivity and electrification assets; the planned separation can crystallize hidden AI-adjacent value.",Automation/electrification separation; non-core divestments; machine-vision recovery.,Portfolio complexity; European industrial softness; execution of separation.,M_IEA_POWER;M_MS_POWER;M_CBRE_DC;M_SP_GLOBAL_DC;TKH_IR
9,5,Non-US,CRL.MI,CAREL Industries,Italy,Borsa Italiana,Thermal & Water,HVAC/refrigeration controls and data-center cooling controls,Mid,Emerging,79,22,16,15,16,12,2,High,"Cooling controls can be the intelligence layer for high-density data centers, yet CAREL is still mostly viewed as HVAC/refrigeration automation.",U.S. HVAC strength; data-center controls; energy-efficiency regulation.,European cycle; family/controlled liquidity; competition from larger HVAC controls.,M_IEA_POWER;M_MS_POWER;M_CBRE_DC;M_SP_GLOBAL_DC;CAREL_IR
10,6,Non-US,SENS.SW,Sensirion,Switzerland,SIX,Sensors & Measurement,"Flow, humidity, gas and environmental sensors",Small-Mid,Latent,79,21,17,14,16,12,1,High,"Environmental sensors are the measurement layer for cooling, HVAC, robotics and edge AI; Sensirion is a high-quality niche sensor company.",A2L/HVAC sensors; industrial sensing; medical/auto design wins.,Swiss franc; premium quality multiple; product-cycle timing.,M_IEA_POWER;M_MS_POWER;M_CBRE_DC;M_SP_GLOBAL_DC;SENSIRION_IR
12,7,Non-US,DSCV.L,discoverIE Group,United Kingdom,LSE,Power & Components,Customised industrial electronics and sensors,Small-Mid,Latent,78,20,18,15,14,11,0,High,A custom electronics compounder with industrial sensing and power niches; it can quietly supply edge-AI and electrification applications without AI branding.,Order recovery; operating margin target upgrade; acquisitions.,UK small-cap discount; industrial cycle; M&A execution.,M_IEA_POWER;M_MS_POWER;M_CBRE_DC;M_SP_GLOBAL_DC;DISCOVERIE_IR
14,8,Non-US,AALB.AS,Aalberts,Netherlands,Euronext Amsterdam,Thermal & Water,"Hydronic flow control, precision components and surface technologies",Mid,Latent,77,21,16,15,15,12,2,Medium,Hydronic flow and thermal control are needed for efficient cooling; Aalberts offers niche industrial/building technologies at a non-AI multiple.,Hydronic HVAC/data-centre demand; portfolio focus; European recovery.,European building cycle; conglomerate discount; indirect AI exposure.,M_IEA_POWER;M_MS_POWER;M_CBRE_DC;M_SP_GLOBAL_DC
16,9,Non-US,AMS.SW,ams-OSRAM,Austria,SIX,Sensors & Photonics,"Optical emitters, sensors and illumination components",Mid,Special Situation,76,22,18,17,14,7,2,Speculative,"Optical sensing/emitters can feed edge AI, robotics and datacom, while balance-sheet and consumer-cycle scars keep expectations low.",Portfolio deleveraging; optical sensing recovery; automotive/industrial design wins.,Debt; smartphone/auto cycles; execution and dilution risk.,M_IEA_POWER;M_MS_POWER;M_CBRE_DC;M_SP_GLOBAL_DC
18,10,Non-US,TTG.L,TT Electronics,United Kingdom,LSE,Power & Components,"Sensors, power conversion and electronics manufacturing",Small,Latent,75,20,18,16,13,8,0,Speculative,"A small UK electronics supplier that senses, powers and connects regulated-market devices; it is a hidden edge-AI component candidate.",Aerospace/defense power; medical electronics; automation/electrification wins.,Small scale; margins; UK liquidity.,M_IEA_POWER;M_MS_POWER;M_CBRE_DC;M_SP_GLOBAL_DC;TT_IR
21,11,Non-US,MGAM.L,Morgan Advanced Materials,United Kingdom,LSE,Semi/Advanced Materials,"Thermal ceramics, carbon and technical ceramic materials",Small-Mid,Special Situation,74,21,18,16,13,8,2,Speculative,"Thermal ceramics and semiconductor materials are relevant to power/heat constraints, but the market is focused on weak semicap/European industrial demand.",Semiconductor stabilization; margin simplification; thermal products recovery.,Weak semicap demand; European industrial slowdown; restructuring risk.,M_IEA_POWER;M_MS_POWER;M_CBRE_DC;M_SP_GLOBAL_DC;MORGAN_IR
24,12,Non-US,KARN.SW,Kardex,Switzerland,SIX,Industrial Automation & Robotics,"Warehouse automation, shuttle systems and light-goods robotics",Mid,Latent,73,20,15,12,16,11,1,Medium,"Warehouse automation becomes more AI-levered as orchestration software improves; Kardex is a focused automation asset, not an AI platform name.",Bookings momentum; lightgoods portfolio expansion; logistics automation cycle.,Capex pauses; premium quality valuation; customer project timing.,M_IEA_POWER;M_MS_POWER;M_CBRE_DC;M_SP_GLOBAL_DC;KARDEX_IR
27,13,Non-US,ATS.TO,ATS Corporation,Canada,TSX/NYSE,Industrial Automation & Robotics,Custom automation systems for advanced manufacturing,Mid,Latent,72,21,15,13,15,10,2,Medium,"Custom automation is the physical implementation layer for AI-enhanced factories, life sciences and energy manufacturing.",Order recovery; EV/battery and life-science projects; margin improvement.,Large project timing; leverage; industrial capex softness.,M_IEA_POWER;M_MS_POWER;M_CBRE_DC;M_SP_GLOBAL_DC;ATS_IR
28,14,Non-US,OXIG.L,Oxford Instruments,United Kingdom,LSE,Semi/Advanced Materials,"Semiconductor, imaging, cryogenics and scientific tools",Small-Mid,Emerging,72,22,15,12,16,10,3,Medium,"Semiconductor, quantum and imaging tools give Oxford latent leverage to AI hardware R&D and advanced metrology without being a mainstream AI stock.",Semiconductor growth; cryogenic/quantum demand; imaging division recovery.,Research capex; China exposure; premium valuation.,M_IEA_POWER;M_MS_POWER;M_CBRE_DC;M_SP_GLOBAL_DC;OXFORD_IR
29,15,Non-US,RSW.L,Renishaw,United Kingdom,LSE,Sensors & Measurement,"Precision metrology, encoders and additive manufacturing",Mid-Large,Latent,72,21,15,12,15,12,3,Medium,AI-enabled manufacturing and robotics require precision measurement; Renishaw is strategic but often screened as a slow industrial metrology name.,Metrology recovery; robotics/automation design wins; additive manufacturing.,Industrial cycle; ownership structure; valuation.,M_IEA_POWER;M_MS_POWER;M_CBRE_DC;M_SP_GLOBAL_DC;RENISHAW_IR
34,16,Non-US,MDA.TO,MDA Space,Canada,TSX,Defense/Space/Edge,"Satellite systems, robotics and geointelligence",Mid,Emerging,71,21,14,12,16,10,2,Medium,"Space data, robotics and geointelligence are high-value AI inputs; MDA is a public space/robotics asset with strong backlog but less U.S. investor coverage.",Satellite programs; Canadarm3/robotics; geointelligence data monetization.,Government program risk; space project execution; valuation after growth.,M_IEA_POWER;M_MS_POWER;M_CBRE_DC;M_SP_GLOBAL_DC;MDA_IR
37,17,Non-US,VCM.TO,Vecima Networks,Canada,TSX,Connectivity & Photonics,Cable/fiber access and cloud-native broadband platforms,Small,Latent,70,20,18,15,12,7,2,Speculative,"Distributed AI and edge compute need upgraded broadband/fiber access; Vecima is small, technical and underfollowed.",DOCSIS 4.0 rollouts; vCMTS adoption; customer transition from qualification to deployment.,Customer concentration; cable capex cycles; small-cap liquidity.,M_IEA_POWER;M_MS_POWER;M_CBRE_DC;M_SP_GLOBAL_DC;VECIMA_IR
42,18,Non-US,MTRS.ST,Munters Group,Sweden,Nasdaq Stockholm,Thermal & Water,Air and liquid cooling for data centers and industrial climate control,Mid,Discovered,69,24,8,10,19,12,4,Medium,"Munters has direct cooling exposure, but the data-center angle is now visible; upside depends on liquid-cooling scale and valuation discipline.",Liquid cooling; energy-efficient data-center orders; capacity expansion.,Crowd discovery; customer concentration; cooling-technology shifts.,M_IEA_POWER;M_MS_POWER;M_CBRE_DC;M_SP_GLOBAL_DC;MUNTERS_DC
44,19,Non-US,ALFA.ST,Alfa Laval,Sweden,Nasdaq Stockholm,Thermal & Water,"Heat exchangers, separation and fluid-handling systems",Large,Emerging,68,22,10,9,17,13,3,Medium,"Heat exchangers and fluid handling are critical to cooling and energy efficiency, but Alfa Laval is a large quality industrial already seeing data-center attention.",Data-center orders; heat-transfer capex; service growth.,Valuation; marine/energy cycles; large-cap discovery.,M_IEA_POWER;M_MS_POWER;M_CBRE_DC;M_SP_GLOBAL_DC;ALFA_AR
45,20,Non-US,BEAN.SW,Belimo Holding,Switzerland,SIX,Thermal & Water,"HVAC actuators, valves, sensors and meters",Large,Emerging,68,22,10,8,17,14,3,Medium,"Belimo is a superb HVAC control compounder with data-center relevance, but valuation and growing market awareness reduce alpha.",Data-center HVAC growth; U.S. building controls; energy-efficiency regulation.,Premium multiple; Swiss franc; crowd discovery.,M_IEA_POWER;M_MS_POWER;M_CBRE_DC;M_SP_GLOBAL_DC;BELIMO_AR
46,21,Non-US,INRN.SW,Interroll,Switzerland,SIX,Industrial Automation & Robotics,"Conveyor, sorter and material-flow systems",Mid,Latent,68,19,15,12,14,11,3,Medium,AI warehouse orchestration needs reliable physical flow; Interroll is a pick-and-shovel for logistics automation.,Warehouse automation recovery; sorter projects; robotics integration.,Cyclical capex; premium quality multiple; slow European demand.,M_IEA_POWER;M_MS_POWER;M_CBRE_DC;M_SP_GLOBAL_DC
50,22,Non-US,AUTO.OL,AutoStore Holdings,Norway,Oslo,Industrial Automation & Robotics,Cube-storage robotics for warehouses,Mid,Emerging,67,21,12,11,15,9,1,Medium,Robotic cube storage becomes more valuable with AI orchestration; the stock’s prior derating creates asymmetry but competition remains intense.,Warehouse automation rebound; software optimization; retail/logistics projects.,Competition; patent/technology risk; project delays.,M_IEA_POWER;M_MS_POWER;M_CBRE_DC;M_SP_GLOBAL_DC
51,23,Non-US,NEX.PA,Nexans,France,Euronext Paris,Power & Grid,Electrification cables and grid infrastructure,Mid-Large,Emerging,67,21,10,11,16,12,3,Medium,Electrification and grid cable scarcity can support AI data-center power buildout; Nexans is less obvious than some U.S. electrical names.,Grid cable demand; electrification margin mix; portfolio focus.,European utilities cycle; project risk; copper volatility.,M_IEA_POWER;M_MS_POWER;M_CBRE_DC;M_SP_GLOBAL_DC
52,24,Non-US,PRY.MI,Prysmian,Italy,Borsa Italiana,Power & Grid,"Power cables, fiber and grid interconnect infrastructure",Large,Emerging,67,22,9,10,17,12,3,Medium,"Cables are a core AI-era bottleneck across grid and fiber, but Prysmian is increasingly recognized as an electrification/data-center supplier.",Grid interconnections; fiber demand; EHV/HVDC projects.,Project execution; commodity prices; large-cap discovery.,M_IEA_POWER;M_MS_POWER;M_CBRE_DC;M_SP_GLOBAL_DC
56,25,Non-US,IFX.DE,Infineon Technologies,Germany,Xetra,Power & Components,"Power semiconductors, microcontrollers and sensors",Large,Emerging,66,22,10,11,15,12,4,Medium,"Infineon’s power chips and controllers are essential to efficient power conversion and edge devices, but it is too large and known for maximum early alpha.",Data-center power supplies; industrial power semis; automotive recovery.,Auto/industrial weakness; valuation; China competition.,M_IEA_POWER;M_MS_POWER;M_CBRE_DC;M_SP_GLOBAL_DC
57,26,Non-US,010120.KS,LS Electric,South Korea,KRX,Power & Grid,"Switchgear, automation and power infrastructure",Large,Emerging,66,22,12,12,16,9,5,Medium,Korean electrical infrastructure supplier with data-center/grid optionality and less global coverage than U.S. peers.,Korea/Asia data-center power; grid automation; overseas expansion.,Korean market cyclicality; FX; discovery after transformer reratings.,M_IEA_POWER;M_MS_POWER;M_CBRE_DC;M_SP_GLOBAL_DC
59,27,Non-US,5801.T,Furukawa Electric,Japan,Tokyo,Connectivity & Photonics,Optical fiber/cable and electrical infrastructure,Mid-Large,Emerging,65,22,10,12,16,10,5,Medium,"Optical fiber and cable are key to AI clusters, but Japanese fiber names have begun to rerate; Furukawa is less crowded than Fujikura.",Optical products; telecom capex; data-center fiber capacity.,Currency; fiber pricing; crowd moving into Japan AI supply chain.,M_IEA_POWER;M_MS_POWER;M_CBRE_DC;M_SP_GLOBAL_DC;FURUKAWA_IR
60,28,Non-US,5802.T,Sumitomo Electric,Japan,Tokyo,Connectivity & Photonics,"Optical fiber, wire harnesses and power infrastructure",Large,Emerging,65,22,10,12,15,11,5,Medium,"A broad Japanese supplier of fiber and electrification hardware; AI campus fiber research helps, but conglomerate complexity tempers upside.",Multicore fiber; grid/automotive recovery; telecom demand.,Conglomerate discount; auto exposure; discovery after fiber news.,M_IEA_POWER;M_MS_POWER;M_CBRE_DC;M_SP_GLOBAL_DC;SUMITOMO_IR
64,29,Non-US,6845.T,Azbil,Japan,Tokyo,Thermal & Water,"Building automation, measurement/control and lifeline systems",Large,Latent,64,20,13,10,15,12,6,Medium,"Building automation and control systems are key to efficient data-center/facility operations, but Azbil is still mostly valued as a Japanese control company.",Building automation; lifeline metering; energy efficiency retrofits.,Japan large-cap valuation; divestment effects; indirect AI exposure.,M_IEA_POWER;M_MS_POWER;M_CBRE_DC;M_SP_GLOBAL_DC;AZBIL_IR
65,30,Non-US,6965.T,Hamamatsu Photonics,Japan,Tokyo,Sensors & Measurement,"Photodetectors, imaging sensors and photonics modules",Mid-Large,Latent,64,22,14,12,13,10,7,Medium,"Photon detection is a raw-signal layer for scientific, medical, industrial and potential photonic AI systems; earnings pressure keeps enthusiasm muted.",Semiconductor instruments; LiDAR/scientific sensors; imaging recovery.,Weak operating profit; Japan photonics competition; premium history.,M_IEA_POWER;M_MS_POWER;M_CBRE_DC;M_SP_GLOBAL_DC;HAMAMATSU_IR
66,31,Non-US,6841.T,Yokogawa Electric,Japan,Tokyo,Industrial Automation & Robotics,"Industrial control, measurement and plant data systems",Large,Emerging,64,20,13,11,15,12,7,Medium,Industrial data/control systems become the interface for autonomous operations and industrial AI; Yokogawa is diversified and not a pure AI play.,Process automation upgrades; cybersecurity/DX; energy efficiency projects.,Oil/gas capex cyclicality; slow software mix; AI already mentioned in DX narrative.,M_IEA_POWER;M_MS_POWER;M_CBRE_DC;M_SP_GLOBAL_DC;YOKOGAWA_IR
70,32,Non-US,AIXA.DE,Aixtron,Germany,Xetra,Semi/Advanced Materials,Deposition equipment for compound semiconductors,Mid,Emerging,63,22,13,12,13,8,5,Speculative,"Compound semis can matter to efficient power/optics, but Aixtron remains tied to cyclical SiC/GaN expectations and investor swings.",SiC/GaN recovery; optoelectronics; data-center power devices.,Order volatility; China/EV cycles; technology concentration.,M_IEA_POWER;M_MS_POWER;M_CBRE_DC;M_SP_GLOBAL_DC
71,33,Non-US,DPLM.L,Diploma,United Kingdom,LSE,Distribution/Services,"Technical distribution in controls, seals and life sciences",Large,Emerging,63,18,11,8,15,13,2,Medium,"Windy City Wire and controls exposure touch data-center infrastructure, but Diploma’s high-quality compounder valuation reduces alpha.",Controls growth; specialist M&A; North America data-center distribution.,High multiple; M&A execution; UK/EU cyclical exposure.,M_IEA_POWER;M_MS_POWER;M_CBRE_DC;M_SP_GLOBAL_DC;DIPLOMA_IR
72,34,Non-US,SMHN.DE,SÜSS MicroTec,Germany,Xetra,Semi/Advanced Materials,"Lithography, bonding and advanced packaging tools",Mid,Discovered,63,22,10,9,17,10,5,Medium,"Advanced packaging tools are important for AI chips, but SÜSS has already been pulled into the semicap AI screen.",Hybrid bonding; advanced packaging capex; memory/logic recovery.,Cyclical semicap orders; valuation; capacity execution.,M_IEA_POWER;M_MS_POWER;M_CBRE_DC;M_SP_GLOBAL_DC
75,35,Non-US,IFCN.SW,INFICON,Switzerland,SIX,Sensors & Measurement,"Vacuum instrumentation, leak detection and process sensors",Mid-Large,Latent,62,20,13,9,15,13,8,Medium,Process sensors and leak detection are essential for fabs and high-reliability manufacturing; INFICON is high quality but expensive.,Semicap recovery; process-control intensity; industrial sensing.,Premium multiple; Swiss franc; cyclical semicap orders.,M_IEA_POWER;M_MS_POWER;M_CBRE_DC;M_SP_GLOBAL_DC
76,36,Non-US,6645.T,OMRON,Japan,Tokyo,Industrial Automation & Robotics,"Sensing, control and factory automation",Large,Emerging,62,20,12,12,14,10,6,Medium,Factory automation can become an AI deployment layer; Omron’s restructuring creates turnaround optionality but the AI linkage is not hidden.,IAB recovery; sensor/control upgrades; restructuring benefits.,Japan automation cycle; China demand; execution risk.,M_IEA_POWER;M_MS_POWER;M_CBRE_DC;M_SP_GLOBAL_DC;OMRON_IR
77,37,Non-US,VACN.SW,VAT Group,Switzerland,SIX,Semi/Advanced Materials,Vacuum valves for semiconductor equipment,Large,Emerging,62,22,9,8,16,13,6,Medium,"A dominant vacuum-valve supplier to semicap; strategically vital, but quality valuation and semicap discovery limit alpha.",Semicap capex recovery; advanced node intensity; service/aftermarket.,Premium valuation; chip capex cycle; large customer exposure.,M_IEA_POWER;M_MS_POWER;M_CBRE_DC;M_SP_GLOBAL_DC
82,38,Non-US,6506.T,Yaskawa Electric,Japan,Tokyo,Industrial Automation & Robotics,"Servos, motion control and industrial robots",Large,Emerging,60,21,9,10,15,11,6,Medium,"Robots and servo drives are obvious beneficiaries of AI-enabled factories, but Yaskawa is a known automation cyclical.",Robotics recovery; motion-control demand; China capex rebound.,China industrial weakness; competition; valuation swings.,M_IEA_POWER;M_MS_POWER;M_CBRE_DC;M_SP_GLOBAL_DC
84,39,Non-US,2395.TW,Advantech,Taiwan,TWSE,Industrial Automation & Robotics,"Industrial computers, edge devices and IoT platforms",Large,Emerging,59,21,10,9,15,10,6,Medium,"Edge AI needs rugged industrial computers; Advantech is well positioned, but it is already a recognized edge-computing supplier.",Edge AI boxes; factory IoT; industrial PC cycle recovery.,Valuation; China/industrial demand; competition.,M_IEA_POWER;M_MS_POWER;M_CBRE_DC;M_SP_GLOBAL_DC
85,40,Non-US,2308.TW,Delta Electronics,Taiwan,TWSE,Power & Components,"Power supplies, thermal management and industrial automation",Mega,Discovered,59,23,6,7,17,13,7,Medium,"Delta is deeply relevant to data-center power and cooling, but it is no longer an undiscovered AI-infrastructure supplier.",AI server power; liquid cooling; industrial automation.,Crowd discovery; high expectations; Taiwan/geopolitical risk.,M_IEA_POWER;M_MS_POWER;M_CBRE_DC;M_SP_GLOBAL_DC
87,41,Non-US,LR.PA,Legrand,France,Euronext Paris,Power & Grid,"Electrical infrastructure, racks and building systems",Large,Discovered,58,21,7,8,16,13,7,Medium,"Data-center electrical and building systems are core to Legrand, but the market increasingly recognizes this exposure.",Data-center products; building electrification; energy efficiency.,Large-cap discovery; valuation; European construction cycle.,M_IEA_POWER;M_MS_POWER;M_CBRE_DC;M_SP_GLOBAL_DC
90,42,Non-US,BESI.AS,BE Semiconductor Industries,Netherlands,Euronext Amsterdam,Semi/Advanced Materials,Die attach and hybrid bonding equipment,Large,Discovered,57,23,5,7,18,11,7,Medium,"BESI is structurally tied to advanced packaging for AI chips, but the market has long identified that thesis.",Hybrid bonding adoption; AI accelerator packaging; memory recovery.,Semicap cycle; high expectations; valuation.,M_IEA_POWER;M_MS_POWER;M_CBRE_DC;M_SP_GLOBAL_DC
91,43,Non-US,ENR.DE,Siemens Energy,Germany,Xetra,Power & Grid,"Grid equipment, gas turbines and transmission systems",Large,Discovered,57,22,6,9,17,9,6,Medium,"AI power demand helps grid/turbine suppliers, but Siemens Energy has already rerated around grid and power scarcity.",Grid backlog; turbine demand; power-system bottlenecks.,Wind turnaround; valuation after rerating; project execution.,M_IEA_POWER;M_MS_POWER;M_CBRE_DC;M_SP_GLOBAL_DC
92,44,Non-US,ASM.AS,ASM International,Netherlands,Euronext Amsterdam,Semi/Advanced Materials,Atomic layer deposition and epitaxy equipment,Large,Discovered,56,23,5,6,18,12,8,Medium,"ASM is a crucial advanced-node tool supplier, but it is already viewed as an AI semicap beneficiary.",GAA/advanced nodes; ALD intensity; AI chip capex.,Valuation; cyclical orders; export restrictions.,M_IEA_POWER;M_MS_POWER;M_CBRE_DC;M_SP_GLOBAL_DC
93,45,Non-US,5803.T,Fujikura,Japan,Tokyo,Connectivity & Photonics,"Optical fiber, cabling and data-center connectivity",Large,Discovered,55,24,2,4,18,12,5,Low,"Fujikura is a textbook example of an under-the-radar AI-infra supplier that the crowd has now discovered; useful as a control, not a fresh-alpha name.",Optical capacity; AI cluster cabling; factory expansion.,Massive rerating; expectation risk; fiber cycle.,M_IEA_POWER;M_MS_POWER;M_CBRE_DC;M_SP_GLOBAL_DC;FUJIKURA_REUTERS
95,46,Non-US,FN,Fabrinet,Cayman Islands / Thailand,NYSE,Connectivity & Photonics,Contract manufacturing for optical communications products,Large,Discovered,54,23,4,5,17,10,5,Medium,"Fabrinet makes optical equipment for AI/datacom supply chains, but it is already widely owned as an optical AI beneficiary.",800G/1.6T manufacturing; customer demand; margin stability.,Customer concentration; Thailand geopolitics/supply chain; crowding.,M_IEA_POWER;M_MS_POWER;M_CBRE_DC;M_SP_GLOBAL_DC
96,47,Non-US,CLS.TO,Celestica,Canada,TSX/NYSE,Connectivity & Services,High-complexity electronics manufacturing and AI server supply chain,Large,Discovered,53,23,3,5,18,10,6,Medium,"Celestica has strong AI server exposure, but that is precisely why it is now a discovered trade.",Hyperscaler programs; networking/server mix; margin expansion.,Crowd discovery; customer concentration; inventory cycles.,M_IEA_POWER;M_MS_POWER;M_CBRE_DC;M_SP_GLOBAL_DC
97,48,Non-US,ABBN.SW,ABB,Switzerland,SIX,Power & Grid,"Electrification, drives, automation and robotics",Mega,Discovered,52,22,4,5,17,14,10,Low,"ABB is strategically relevant to electrification and automation, but it is too large, too covered and too explicitly linked to automation for early alpha.",Electrification backlog; drives/robotics; energy efficiency.,Mega-cap valuation; global cycle; crowd ownership.,M_IEA_POWER;M_MS_POWER;M_CBRE_DC;M_SP_GLOBAL_DC
98,49,Non-US,SIE.DE,Siemens,Germany,Xetra,Industrial Automation & Robotics,"Automation, digital industries and electrification software/hardware",Mega,Discovered,50,22,4,5,17,13,11,Low,Siemens owns many AI deployment layers but is already a core global industrial-automation compounder.,Digital Industries recovery; electrification; industrial software.,Large-cap discovery; industrial cycle; conglomerate complexity.,M_IEA_POWER;M_MS_POWER;M_CBRE_DC;M_SP_GLOBAL_DC
100,50,Non-US,SU.PA,Schneider Electric,France,Euronext Paris,Power & Grid,"Energy management, data-center power and cooling infrastructure",Mega,Discovered,46,24,1,3,19,14,15,Low,"Schneider is a direct AI infrastructure winner, but the crowd has clearly found it; included as a negative-control for the alpha screen.",Data-center power/cooling demand; Southeast Asia buildout; services.,Crowded trade; premium valuation; no longer hidden.,M_IEA_POWER;M_MS_POWER;M_CBRE_DC;M_SP_GLOBAL_DC;M_SCHNEIDER_REUTERS
2,1,US,BDC,Belden,United States,NYSE,Connectivity & IT/OT,"Industrial data networking, fiber/copper connectivity and edge infrastructure",Mid,Emerging,84,23,17,15,18,12,1,High,"A quiet backbone of IT/OT convergence: industrial networks, mission-critical data movement and fiber/copper links can become the data layer for edge AI and AI-era factories.",Factory data layer upgrades; data-center/network cabling demand; margin mix shift toward solutions.,Industrial cycle; inventory digestion; competition from larger network vendors.,M_IEA_POWER;M_MS_POWER;M_CBRE_DC;M_SP_GLOBAL_DC;BELDEN_IR
3,2,US,ENS,EnerSys,United States,NYSE,Power & Grid,"Batteries, UPS backup and stored-energy systems",Mid,Latent,84,22,18,16,17,12,1,High,"AI data centers need resilient power, ride-through and backup energy; EnerSys is a power reliability supplier that is not generally treated as an AI stock.",UPS refresh cycle; grid constraints; reserve-power margin expansion.,Lead/lithium input costs; telecom capex; execution on newer energy systems.,M_IEA_POWER;M_MS_POWER;M_CBRE_DC;M_SP_GLOBAL_DC;ENERSYS_IR
